title,author,pub_year,venue,abstract
Evolution of life histories: theory and analysis,['D Roff'],1993,NA,"There are many different types of organisms in the world: they differ in size, physiology, appearance, and life history. The challenge for evolutionary biology is to explain how such diversity arises. The Evolution of Life Histories does this by showing that natural selection is"
The measurement of selection on correlated characters,"['R Lande', 'SJ Arnold']",1983,Evolution,"Multivariate statistical methods are derived for measuring selection solely from observed changes in the distribution of phenotypic characters in a population within a generation. Selective effects are readily detectable in characters that do not change with age, such as"
Geometric morphometrics for biologists: a primer,"['ML Zelditch', 'DL Swiderski', 'HD Sheets']",2012,NA,The first edition of Geometric Morphometrics for Biologists has been the primary resource for teaching modern geometric methods of shape analysis to biologists who have a stronger background in biology than in multivariate statistics and matrix algebra. These geometric
Gene flow and the geographic structure of natural populations,['M Slatkin'],1987,Science,There is abundant geographic variation in both morphology and gene frequency in most species. The extent of geographic variation results from a balance of forces tending to produce local genetic differentiation and forces tending to produce genetic homogeneity
Principles of animal communication,"['JW Bradbury', 'SL Vehrencamp']",1998,NA,"2 Amy, M., M. Monbureau, C. Durand, D. Gomez, M. Thery, and G. Leboucher. 2008. Female  canary mate preferences: differential use of information from two types of male-male  interaction. Animal Behaviour 76: 971–982  3 Aragon, P. 2009. Conspecific male chemical"
Integrating animal temperament within ecology and evolution,"['D Réale', 'SM Reader', 'D Sol', 'PT McDougall']",2007,Biological …,"Temperament describes the idea that individual behavioural differences are repeatable over time and across situations. This common phenomenon covers numerous traits, such as aggressiveness, avoidance of novelty, willingness to take risks, exploration, and sociality"
Geometric morphometrics: ten years of progress following the 'revolution',"['DC Adams', 'FJ Rohlf', 'DE Slice']",2004,Italian Journal of Zoology,"The analysis of shape is a fundamental part of much biological research. As the field of statistics developed, so have the sophistication of the analysis of these types of data. This lead to multivariate morphometrics in which suites of measurements were analyzed together"
Genotype‐environment interaction and the evolution of phenotypic plasticity,"['S Via', 'R Lande']",1985,Evolution,"Studies of spatial variation in the environment have primarily focused on how genetic variation can be maintained. Many one‐locus genetic models have addressed this issue, but, for several reasons, these models are not directly applicable to quantitative (polygenic)"
"Sexual dimorphism, sexual selection, and adaptation in polygenic characters",['R Lande'],1980,Evolution,The evolution of sexual dimorphism in quantitative characters under natural and sexual selection acting differently on the sexes is analyzed using population genetics models. The effects of genes when in males may be correlated with their effects when in females
The strength of phenotypic selection in natural populations,"['JG Kingsolver', 'HE Hoekstra']",2001,The American …,How strong is phenotypic selection on quantitative traits in the wild? We reviewed the literature from 1984 through 1997 for studies that estimated the strength of linear and quadratic selection in terms of standardized selection gradients or differentials on natural
Heritability in the genomics era—concepts and misconceptions,"['PM Visscher', 'WG Hill', 'NR Wray']",2008,Nature reviews genetics,"Heritability allows a comparison of the relative importance of genes and environment to the variation of traits within and across populations. The concept of heritability and its definition as an estimable, dimensionless population parameter was introduced by Sewall Wright and"
The ecology of adaptive radiation,['D Schluter'],2000,NA,
"Morphology, performance and fitness",['SJ Arnold'],1983,American Zoologist,"Selection can be measured in natural populations by the changes it causes in the means, variances and covariances of phenotypic characters. Furthermore the force of selection can be measured in conventional statistical terms that also play a key role in theoretical"
"Adaptation, migration or extirpation: climate change outcomes for tree populations","['SN Aitken', 'S Yeaman', 'JA Holliday']",2008,Evolutionary …,"Species distribution models predict a wholesale redistribution of trees in the next century, yet migratory responses necessary to spatially track climates far exceed maximum post‐glacial rates. The extent to which populations will adapt will depend upon phenotypic variation"
Developmental constraints and evolution: a perspective from the Mountain Lake conference on development and evolution,"['JM Smith', 'R Burian', 'S Kauffman']",1985,… Quarterly Review of …,"Developmental constraints (defined as biases on the production of variant phenotypes or limitations on phenotypic variability caused by the structure, character, composition, or dynamics of the developmental system) undoubtedly play a significant role in evolution. Yet"
Multivariate analysis in ecology and systematics: panacea or Pandora's box?,"['FC James', 'CE McCulloch']",1990,Annual review of Ecology and …,"Multivariate analysis provides statistical methods for study of the joint rela tionships of variables in data that contain intercorrelations. Because several variables can be considered simultaneously, interpretations can be made that are not possible with univariate"
On the measurement of natural and sexual selection: theory,"['SJ Arnold', 'MJ Wade']",1984,Evolution,"The primary contributions of this paper are, first, an elucidation of the relationship between various measures of selection and their relationships to predictive equations for evolutionary change. We show that the opportunity for selection (variance in relative fitness) places an"
Ecological speciation,['P Nosil'],2012,NA,"The origin of biological diversity, via the formation of new species, can be inextricably linked to adaptation to the ecological environment. Specifically, ecological processes are central to the formation of new species when barriers to gene flow (reproductive isolation) evolve"
The dynamical theory of coevolution: a derivation from stochastic ecological processes,"['U Dieckmann', 'R Law']",1996,Journal of mathematical biology,In this paper we develop a dynamical theory of coevolution in ecological communities. The derivation explicitly accounts for the stochastic components of evolutionary change and is based on ecological processes at the level of the individual. We show that the
Morphological integration,"['EC Olson', 'RL Miller']",1999,NA,"Despite recent advances in genetics, development, anatomy, systematics, and morphometrics, the synthesis of ideas and research agenda put forth in the classic Morphological Integration remains remarkably fresh, timely, and relevant. Pioneers in"
Stabilizing selection and the comparative analysis of adaptation,['TF Hansen'],1997,Evolution,"Comparative studies tend to differ from optimality and functionality studies in how they treat adaptation. While the comparative approach focuses on the origin and change of traits, optimality studies assume that adaptations are maintained at an optimum by stabilizing"
Adaptive radiation along genetic lines of least resistance,['D Schluter'],1996,Evolution,"Are measurements of quantitative genetic variation useful for predicting long‐term adaptive evolution? To answer this question, I focus on gmax, the multivariate direction of greatest additive genetic variance within populations. Original data on threespine sticklebacks"
"Dynamics of adaptation and diversification: a 10,000-generation experiment with bacterial populations","['RE Lenski', 'M Travisano']",1994,Proceedings of the National …,"We followed evolutionary change in 12 populations of Escherichia coli propagated for 10,000 generations in identical environments. Both morphology (cell size) and fitness (measured in competition with the ancestor) evolved rapidly for the first 2000 generations or"
Optimality theory in evolutionary biology,"['GA Parker', 'JM Smith']",1990,Nature,"REVIEW ARTICLE Optimality theory in evolutionary biology G, A, Parker & J, Maynard Smith  Optimization models help us to test our insight into the biological constraints that influence the  outcome of evolution. They serve to improve our understanding about adaptations, rather than"
Allometry for sexual size dimorphism: pattern and process in the coevolution of body size in males and females,['DJ Fairbairn'],1997,Annual review of ecology and systematics,"Sexual size dimorphism (SSD) is common in both plants and animals, and current evidence suggests that it reflects the adaptation of males and females to their different reproductive roles. When species are compared within a clade, SSD is frequently found to vary with body"
"Suppression of oxidative stress by β-hydroxybutyrate, an endogenous histone deacetylase inhibitor","['T Shimazu', 'MD Hirschey', 'J Newman', 'W He']",2013,…,Concentrations of acetyl–coenzyme A and nicotinamide adenine dinucleotide (NAD+) affect histone acetylation and thereby couple cellular metabolic status and transcriptional regulation. We report that the ketone body d-β-hydroxybutyrate (βOHB) is an endogenous
Perspective: the pace of modern life: measuring rates of contemporary microevolution,"['AP Hendry', 'MT Kinnison']",1999,Evolution,"We evaluate methods for measuring and specifying rates of microevolution in the wild, with particular regard to studies of contemporary, often deemed “rapid,” evolution. A considerable amount of ambiguity and inconsistency persists within the field, and we provide a number of"
The road to modularity,"['GP Wagner', 'M Pavlicev', 'JM Cheverud']",2007,Nature Reviews Genetics,"A network of interactions is called modular if it is subdivided into relatively autonomous, internally highly connected components. Modularity has emerged as a rallying point for research in developmental and evolutionary biology (and specifically evo–devo), as well as"
Regression analysis of natural selection: statistical inference and biological interpretation,"['T Mitchell‐Olds', 'RG Shaw']",1987,Evolution,Recent theoretical work in quantitative genetics has fueled interest in measuring natural selection in the wild. We discuss statistical and biological issues that may arise in applications of Lande and Arnold's (1983) multiple‐regression approach to measuring
Evaluation of the rate of evolution in natural populations of guppies (Poecilia reticulata),"['DN Reznick', 'FH Shaw', 'FH Rodd', 'RG Shaw']",1997,Science,Natural populations of guppies were subjected to an episode of directional selection that mimicked natural processes. The resulting rate of evolution of age and size at maturity was similar to rates typically obtained for traits subjected to artificial selection in laboratory
Of dreaming and wakefulness,"['RR Llinás', 'D Paré']",1991,Neuroscience,"Following a set of studies concerning the intrinsic electrophysiology of mammalian central neurons in relation to global brain function, we reach the following conclusions:(i) the main difference between wakefulness and paradoxical sleep lies in the weight given to sensory"
Heterochrony,"['ML McKinney', 'KJ McNamara']",1991,Heterochrony,In 1859 Charles Darwin published The Origin of Species by Means of Natural Selection. No single book before or since has had such a profound effect on evolutionary theory. To most present-day biologists it is seen as the bright light that burst upon the Dark
"Phenotypic, genetic, and environmental morphological integration in the cranium",['JM Cheverud'],1982,Evolution,"The hypotheses that developmentally and functionally related cranial traits are relatively tightly morphologically integrated in the phenotype, genotype, and with respect to environmental factors were tested. Sets of developmentally and functionally related traits, F"
Life history variation in primates,"['PH Harvey', 'TH Clutton‐Brock']",1985,Evolution,"Extensive variation in life‐history patterns is documented across primate species. Variables included are gestation length, neonatal weight, litter size, age at weaning, age at sexual maturity, age at first breeding, longevity, and length of the estrous cycle. Species within"
A comparison of genetic and phenotypic correlations,['JM Cheverud'],1988,Evolution,"Genetic variances and correlations lie at the center of quantitative evolutionary theory. They are often difficult to estimate, however, due to the large samples of related individuals that are required. I investigated the relationship of genetic‐and phenotypic‐correlation"
The evolution of costly mate preferences II. The “handicap” principle,"['Y Iwasa', 'A Pomiankowski', 'S Nee']",1991,Evolution,We use a general additive quantitative genetic model to study the evolution of costly female mate choice by the “handicap” principle. Two necessary conditions must be satisfied for costly preference to evolve. The conditions are (i) biased mutation pressure on viability and
Constraint to adaptive evolution in response to global warming,"['JR Etterson', 'RG Shaw']",2001,science,"We characterized the genetic architecture of three populations of a native North American prairie plant in field conditions that simulate the warmer and more arid climates predicted by global climate models. Despite genetic variance for traits under selection, among-trait"
Phylogenies and quantitative characters,['J Felsenstein'],1988,Annual Review of Ecology and Systematics,"Systematists and evolutionary geneticists don't often talk to each other, and they routinely disparage each other's work as being of little relevance to evolution. Systematists sometimes invoke the punctuationist argument that most evolutionary change does not occur by"
Population structure in Daphnia obtusa: quantitative genetic and allozymic variation.,['K Spitze'],1993,Genetics,Quantitative genetic analyses for body size and for life history characters within and among populations of Daphnia obtusa reveal substantial genetic variance at both hierarchical levels for all traits measured. Simultaneous allozymic analysis on the same population
The evolution of maternal characters,"['M Kirkpatrick', 'R Lande']",1989,Evolution,"We develop quantitative‐genetic models for the evolution of multiple traits under maternal inheritance, in which traits are transmitted through non‐Mendelian as well as Mendelian mechanisms, and maternal selection, in which the fitness of offspring depends on their"
"Homologues, natural kinds and the evolution of modularity",['GP Wagner'],1996,American Zoologist,The fact that phenotypic evolution can be studied on a character by character basis suggests that the body is composed of locally integrated units. These units can be considered as modular parts of the body which integrate functionally related characters into units of
The control of neuron number,"['RW Williams', 'K Herrup']",1988,Annual review of neuroscience,"How an animal senses, perceives, and acts depends on the organization and number of elements that make up its nervous system. Of several kinds of neural elements, ranging in size from ion channels to cytoarchitectonic divisions, the neuron is the fundamental building"
Natural selection and animal personality,"['NJ Dingemanse', 'D Réale']",2005,Behaviour,"Recent progress has been made on the study of personality in animals, both from a mechanistic and a functional perspective. While we start knowing more about the proximal mechanisms responsible for the consistent differences in behaviour between individuals in a"
Adaptation to an extraordinary environment by evolution of phenotypic plasticity and genetic assimilation,['R Lande'],2009,Journal of evolutionary biology,"Adaptation to a sudden extreme change in environment, beyond the usual range of background environmental fluctuations, is analysed using a quantitative genetic model of phenotypic plasticity. Generations are discrete, with time lag τ between a critical period for"
On the measurement of natural and sexual selection: applications,"['SJ Arnold', 'MJ Wade']",1984,Evolution,The study of selection in natural populations is a neglected field. So far only a few investigators have succeeded in measuring lifetime fitness or selection on multiple phenotypic characters. Studies of multiple selection episodes are also rare. Most traits of
The statistics of natural selection on animal populations,['BF Manly'],2013,NA,"In the concluding chapter of his famous book on the theory of evolution by natural selection, Charles Darwin (1859) remarked that: When the views entertained in this volume on the origin of species, or when analogous views are generally admitted, we can dimly foresee"
Constraints on phenotypic evolution,['SJ Arnold'],1992,The American Naturalist,"Constraints on phenotypic evolution can take a variety of forms. Constraints can arise from inheritance, selection, development, and design limits. Contemporary visions of the evolutionary process often focus on one or two of these varieties and ignore the others. A"
Estimating the form of natural selection on a quantitative trait,['D Schluter'],1988,Evolution,The fitness function f relates fitness of individuals to the quantitative trait under natural selection. The function is useful in predicting fitness differences among individuals and in revealing whether an optimum is present within the range of phenotypes in the population. It
"Size, temperature, and fitness: three rules","['JG Kingsolver', 'RB Huey']",2008,Evolutionary Ecology Research,"Question: Associations of body size and of body temperature with fitness have complex relationships for ectotherms, but three general patterns are known. Bigger is better: Larger body size is frequently associated with greater fitness within populations. Hotter is smaller"
Genomics and the origin of species,"['O Seehausen', 'RK Butlin', 'I Keller', 'CE Wagner']",2014,Nature Reviews …,"Speciation is a fundamental evolutionary process, the knowledge of which is crucial for understanding the origins of biodiversity. Genomic approaches are an increasingly important aspect of this research field. We review current understanding of genome-wide"
Variation in sexual reproduction in orchids and its evolutionary consequences: a spasmodic journey to diversification,"['RL Tremblay', 'JD Ackerman']",2005,Biological Journal of …,"The great taxonomic diversity of the Orchidaceae is often attributed to adaptive radiation for specific pollinators driven by selection for outcrossing. However, when one looks beyond the product to the process, the evidence for selection is less than overwhelming. We explore this"
Quantitative genetics and developmental constraints on evolution by selection,['JM Cheverud'],1984,Journal of theoretical biology,"It has often been argued that the principles of random mutation and selection are insufficient to account for macroevolutionary phenomena, such as the origin of morphological novelty and directionality in evolution. A third, epigenetic, principle is said to be required and this"
"Primates, brains and ecology","['TH Clutton‐Brock', 'PH Harvey']",1980,Journal of zoology,The paper examines systematic relationships among primates between brain size (relative to body size) and differences in ecology and social system. Marked differences in relative brain size exist between families. These are correlated with inter‐family differences in body
Developmental integration and the evolution of pleiotropy,['JM Cheverud'],1996,American Zoologist,"The different forms of morphological integration, developmental, functional, genetic, and evolutionary are defined and their theoretical relationships explored. Quantitative genetic models predict that the co-selection of traits involved in a common function will lead to"
Morphological integration and developmental modularity,['CP Klingenberg'],2008,"Annual review of ecology, evolution, and …","Biological systems, from molecular complexes to whole organisms and ecological interactions, tend to have a modular organization. Modules are sets of traits that are internally integrated by interactions among traits, but are relatively independent from other"
Evolutionary ecology and human behavior,['EA Smith'],2017,NA,"First published 1992 by Transaction Publishers Published 2017 by Routledge 2 Park  Square, Milton Park, Abingdon, Oxon OX14 4RN 711 Third Avenue, New York, NY 10017, USA  Routledge is an imprint of the Taylor & Francis Group, an informa business Copyright© 1992"
A neo-Darwinian commentary on macroevolution,"['B Charlesworth', 'R Lande', 'M Slatkin']",1982,Evolution,"The neo-Darwinian synthesis that resulted from the integration of Mendelian genetics into evolutionary theory has dominated evolutionary biology for the last 30 to 40 years, due largely to its agreement with a huge body of experimental and observational data. The"
A model for development and evolution of complex morphological structures,"['WR Atchley', 'BK Hall']",1991,Biological Reviews,"Page 1. Biol. Rev. (1991). 66, pp. 101-157 Printed in Great Britain I01 A MODEL FOR DEVELOPMENT AND EVOLUTION OF COMPLEX MORPHOLOGICAL STRUCTURES BY WILLIAM R. ATCHLEY Department of Genetics, North Carolina State University, Raleigh"
Ecological explanations for (incomplete) speciation,"['P Nosil', 'LJ Harmon', 'O Seehausen']",2009,Trends in ecology & evolution,"Divergent natural selection has been shown to promote speciation in many taxa. However, although divergent selection often initiates the process of speciation, it often fails to complete it. Several time-based, geographic and genetic factors have been recognized to explain this"
Interacting phenotypes and the evolutionary process: I. Direct and indirect genetic effects of social interactions,"['AJ Moore', 'ED Brodie III', 'JB Wolf']",1997,Evolution,"Interacting phenotypes are traits whose expression is affected by interactions with conspecifics. Commonly‐studied interacting phenotypes include aggression, courtship, and communication. More extreme examples of interacting phenotypes—traits that exist"
Adaptation and the goals of evolutionary research,"['HK Reeve', 'PW Sherman']",1993,The Quarterly Review of Biology,"Adaptation is and has always been a sloppery concept. Even among contemporary evolutionary biologists there is no consensus about how to identify adaptive traits. Most definition of adaptation incorporate elements of history. Among these, some require that"
Testing for different rates of continuous trait evolution using likelihood,"[""BC O'Meara"", 'C Ané', 'MJ Sanderson', 'PC Wainwright']",2006,Evolution,"Rates of phenotypic evolution have changed throughout the history of life, producing variation in levels of morphological, functional, and ecological diversity among groups. Testing for the presence of these rate shifts is a key component of evaluating hypotheses"
Behavioural syndromes differ predictably between 12 populations of three‐spined stickleback,"['NJ Dingemanse', 'J Wright', 'AJN Kazem']",2007,Journal of Animal …,"Animals often differ in suites of correlated behaviours, comparable with how humans differ in personality. Constraints on the architecture of behaviour have been invoked to explain why such 'behavioural syndromes' exist. From an adaptationist viewpoint, however, behavioural"
Evolution of generalists and specialists in spatially heterogeneous environments,['PH Van Tienderen'],1991,Evolution,Quantitative genetic models are used to investigate the evolution of generalists and specialists in a coarse‐grained environment with two habitat types when there are costs attached to being a generalist. The outcomes for soft and hard selection models are
The measurement of selection on quantitative traits: biases due to environmental covariances between traits and fitness,['MD Rausher'],1992,Evolution,The use of regression techniques for estimating the direction and magnitude of selection from measurements on phenotypes has become widespread in field studies. A potential problem with these techniques is that environmental correlations between fitness and the
Use and misuse of the reduced major axis for line‐fitting,['RJ Smith'],2009,American Journal of Physical Anthropology: The …,Many investigators use the reduced major axis (RMA) instead of ordinary least squares (OLS) to define a line of best fit for a bivariate relationship when the variable represented on the X‐axis is measured with error. OLS frequently is described as requiring the assumption
Genetic covariance of fitness correlates: what genetic correlations are made of and why it matters,['D Houle'],1991,Evolution,"The genetic variance‐covariance matrix, G, is determined in part by functional architecture, the pathways by which variation in genotype influences phenotype. I develop a simple architectural model for G for two traits under directional selection constrained by their"
Developmental structure in brain evolution,"['BL Finlay', 'RB Darlington', 'N Nicastro']",2001,Behavioral and Brain …,How does evolution grow bigger brains? It has been widely assumed that growth of individual structures and functional systems in response to niche-specific cognitive challenges is the most plausible mechanism for brain expansion in mammals. Comparison
