title,author,pub_year,venue,abstract
Sexual size dimorphism in chipmunks,['H Levenson'],1990,Journal of Mammalogy,"Sexual size dimorphism among chipmunks is widespread, with females being larger in the taxa exhibiting such dimorphism. The degree of sexual size dimorphism is not correlated with body size. Females generally are larger in severe environments relative to moderate"
Mouse models for the analysis of myopia: an analysis of variation in eye size of adult mice.,"['G Zhou', 'RW Williams']",1999,… and vision science: official publication of the …,"PURPOSE: To assess the relative importance of genetic and environmental factors that modulate eye growth, eyes, lenses, and retinas of 507 mice belonging to 50 strains were measured. METHODS: Mice of both sexes and a wide range of ages (27 to 526 days) were"
Evolutionary genetics of ageing in the wild: empirical patterns and future perspectives,"['AJ Wilson', 'A Charmantier', 'JD Hadfield']",2008,Functional Ecology,Summary 1 Classical evolutionary theory states that senescence should arise as a consequence of the declining force of selection late in life. Although the quantitative genetic predictions of hypotheses derived from this theory have been extensively tested in
Human genetic distance studies: Present status and future prospects,['LB Jorde'],1985,Annual Review of Anthropology,"Genetic distance methodologies have been reviewed extensively (27, 42, 72, 73, 76, 81, 84, 93, 100, 157, 175). This review does not attempt to duplicate these efforts, several of which are comprehensive. Rather, the basic families of genetic distances and display techniques"
Foraging trait (co) variances in stickleback evolve deterministically and do not predict trajectories of adaptive diversification,"['D Berner', 'WE Stutz', 'DI Bolnick']",2010,Evolution: International Journal …,"How does natural selection shape the structure of variance and covariance among multiple traits, and how do (co) variances influence trajectories of adaptive diversification? We investigate these pivotal but open questions by comparing phenotypic (co) variances among"
Quantitative genetic models of sexual selection,['SJ Arnold'],1985,Experientia,Quantitative genetic models of sexual selection have disporven some of the central tenets of both the handicap mechanism and the 'sexy son'hypothesis. These results suggest that the “good genes' approach to sexual selection may generally lead to erroneous results
A method for detecting the biosystematic significance of the essential oil composition: The case of five Hellenic Hypericum L. species,"['PV Petrakis', 'M Couladis', 'V Roussis']",2005,Biochemical Systematics and …,"We examined the importance of the constitutive terpenoids of five species of Hypericum native to the Greek mainland, Crete Island and the west Aegean. The species studied are Hypericum empetrifolium Willd.(sect. Coridium Spach), Hypericum rumeliacum Boiss. subsp"
The use of marker‐based relationship information to estimate the heritability of body weight in a natural population: a cautionary tale,"['SC Thomas', 'DW Coltman']",2002,Journal of Evolutionary …,"A number of procedures have been developed that allow the genetic parameters of natural populations to be estimated using relationship information inferred from marker data rather than known pedigrees. Three published approaches are available; the regression, pair‐wise"
Assessment of parasite‐mediated selection in a host–parasite system in plants,['R Medel'],2000,Ecology,"A two‐year field study was conducted to evaluate the potential of two cactus species, Echinopsis chilensis and Eulychnia acida, to evolve defensive traits against the parasitic mistletoe Tristerix aphyllus (Loranthaceae). The adaptive value of host traits against"
Ernst Mayr and the integration of geographic and ecological factors in speciation,['P Nosil'],2008,Biological Journal of the Linnean Society,"Mayr's best recognized scientific contributions include the biological species concept and the theory of geographic speciation. In the latter, reproductive isolation evolves as an incidental by-product of genetic divergence between allopatric populations. Mayr noted that"
Developmental interactions and the constituents of quantitative variation,"['JB Wolf', 'WA Frankino', 'AF Agrawal', 'EDB III']",2001,Evolution,"Development is the process by which genotypes are transformed into phenotypes. Consequently, development determines the relationship between allelic and phenotypic variation in a population and, therefore, the patterns of quantitative genetic variation and"
Genetic and phenotypic aspects of life-history evolution in animals,['RH Smith'],1991,Advances in Ecological Research,Publisher Summary This chapter discusses the genetic and phenotypic aspects of life-history evolution in animals. The quantitative genetics description of life–history evolution is developed in relation to a bivariate case of the general iteroparous life-cycle model. This
"Body size, brain size and feeding strategies",['RD Martin'],1984,Food acquisition and processing in primates,"The concept of allometry (non-linear scaling of individual biological parameters to body size) has been applied repeatedly, if somewhat intermittently, to morphological characteristics for almost a century. Particular interest has focused on brain size, beginning with the studies of"
"GENETIC CORRELATIONS AMONG TRAITS DETERMINING MIGRATORY TENDENCY IN THE SAND CRICKET, GRYLLUS FIRMUS","['DJ Fairbairn', 'DA Roff']",1990,Evolution,"Migration by flight is an important component of the life cycles of most insects. The probability that a given insect will migrate by flight is influenced by many factors, most notably the presence or absence of fully‐developed wings and functional flight musculature"
The shape of human evolution: a geometric morphometrics perspective,"['KL Baab', 'KP McNulty', 'FJ Rohlf']",2012,"… Anthropology: Issues, News …","Study of morphological form is fundamental to the discipline of paleoanthropology. The size and shape of our ancestors' anatomical features have long been the focus of research on hominin systematics, phylogeny, functional morphology, ontogeny, variation, and"
The causes of brain enlargement in human evolution,['R Foley'],1990,Behavioral and Brain Sciences,"The ""radiator"" theory of brain evolution is proposed to account for ""mosaic  evolution"" whereby brain size began to increase rapidly in the genus Homo well over a million  years after bipedalism had been selected for in early hominids. Because hydrostatic pressures"
"Relative brain size, stratification, and social structure in anthropoids",['T Sawaguchi'],1990,Primates,The relationships between relative brain size and both stratification and social structure were examined in a total of 82 species of anthropoids. The species were divided into a total of 42 congeneric groups which consisted of congeneric species with similar ecologies and
Hominoid visual brain structure volumes and the position of the lunate sulcus,"['AA De Sousa', 'CC Sherwood', 'H Mohlberg']",2010,Journal of human …,"It has been argued that changes in the relative sizes of visual system structures predated an increase in brain size and provide evidence of brain reorganization in hominins. However, data about the volume and anatomical limits of visual brain structures in the extant taxa"
Direct selection on male attractiveness and female preference fails to produce a response,"['M Hall', 'AK Lindholm', 'R Brooks']",2004,BMC Evolutionary Biology,"Theoretical studies suggest that direct and indirect selection have the potential to cause substantial evolutionary change in female mate choice. Similarly, sexual selection is considered a strong force in the evolution of male attractiveness and the exaggeration of"
Persistence of changes in the genetic covariance matrix after a bottleneck,"['MC Whitlock', 'PC Phillips', 'K Fowler']",2002,Evolution,"Genetic variance, phenotypic variance, and the genetic covariance matrix (G) can change as a result of genetic drift. These changes will persist over time to some extent and will continue if population size remains relatively small. Nine populations founded by a single pair of"
Internal and external constraints in the evolution of morphological allometries in a butterfly,"['WA Frankino', 'BJ Zwaan', 'DL Stern']",2007,… Journal of Organic …,"Much diversity in animal morphology results from variation in the relative size of morphological traits. The scaling relationships, or allometries, that describe relative trait size can vary greatly in both intercept and slope among species or other animal groups. Yet"
Genetic constraints predict evolutionary divergence in Dalechampia blossoms,"['GH Bolstad', 'TF Hansen', 'C Pélabon']",2014,… of the Royal …,"If genetic constraints are important, then rates and direction of evolution should be related to trait evolvability. Here we use recently developed measures of evolvability to test the genetic constraint hypothesis with quantitative genetic data on floral morphology from the"
"Relative brain size, stratification, and social structure in anthropoids",['T Sawaguchi'],1990,Primates,The relationships between relative brain size and both stratification and social structure were examined in a total of 82 species of anthropoids. The species were divided into a total of 42 congeneric groups which consisted of congeneric species with similar ecologies and
Hominoid visual brain structure volumes and the position of the lunate sulcus,"['AA De Sousa', 'CC Sherwood', 'H Mohlberg']",2010,Journal of human …,"It has been argued that changes in the relative sizes of visual system structures predated an increase in brain size and provide evidence of brain reorganization in hominins. However, data about the volume and anatomical limits of visual brain structures in the extant taxa"
Direct selection on male attractiveness and female preference fails to produce a response,"['M Hall', 'AK Lindholm', 'R Brooks']",2004,BMC Evolutionary Biology,"Theoretical studies suggest that direct and indirect selection have the potential to cause substantial evolutionary change in female mate choice. Similarly, sexual selection is considered a strong force in the evolution of male attractiveness and the exaggeration of"
Persistence of changes in the genetic covariance matrix after a bottleneck,"['MC Whitlock', 'PC Phillips', 'K Fowler']",2002,Evolution,"Genetic variance, phenotypic variance, and the genetic covariance matrix (G) can change as a result of genetic drift. These changes will persist over time to some extent and will continue if population size remains relatively small. Nine populations founded by a single pair of"
Internal and external constraints in the evolution of morphological allometries in a butterfly,"['WA Frankino', 'BJ Zwaan', 'DL Stern']",2007,… Journal of Organic …,"Much diversity in animal morphology results from variation in the relative size of morphological traits. The scaling relationships, or allometries, that describe relative trait size can vary greatly in both intercept and slope among species or other animal groups. Yet"
Genetic constraints predict evolutionary divergence in Dalechampia blossoms,"['GH Bolstad', 'TF Hansen', 'C Pélabon']",2014,… of the Royal …,"If genetic constraints are important, then rates and direction of evolution should be related to trait evolvability. Here we use recently developed measures of evolvability to test the genetic constraint hypothesis with quantitative genetic data on floral morphology from the"
Quantitative genetics of geometric shape: heritability and the pitfalls of the univariate approach,['CP Klingenberg'],2003,Evolution,"There is considerable interest in the evolution of morpho-logical traits, and morphometric studies in combination with the multivariate theory of quantitative genetics can provide a detailed understanding of the variation and evolutionary potential of these traits. For both"
Technique and application in dental anthropology,"['JD Irish', 'GC Nelson']",2008,NA,"Bringing together a variety of accomplished dental researchers, this book covers a range of topics germane to the study of human and other primate teeth. The chapters encompass work on individuals to samples, ranging from prehistoric to modern times. The focus"
Rapid independent trait evolution despite a strong pleiotropic genetic correlation,"['JK Conner', 'K Karoly', 'C Stewart']",2011,The American …,"Genetic correlations are the most commonly studied of all potential constraints on adaptive evolution. We present a comprehensive test of constraints caused by genetic correlation, comparing empirical results to predictions from theory. The additive genetic correlation"
"GENETIC CORRELATIONS AMONG MORPHOMETRIC TRAITS AND RATES OF GROWTH AND DIFFERENTIATION IN THE GREEN TREE FROG, HYLA CINEREA",['MS Blouin'],1992,Evolution,"It is often proposed that the morphometric shape of animals often evolves as a correlated response to selection on life‐history traits such as whole‐body growth and differentiation rates. However, there exists little empirical information on whether selection on rates of"
Effect of an experimental bottleneck on morphological integration in the housefly,"['EH Bryant', 'LM Meffert']",1988,Evolution,Three measures of multivariate integration were derived from both additive genetic covariance and correlation matrices estimated from parent‐offspring covariances to investigate the effect of bottlenecks of different sizes on genetic integration of morphological
Some basic principles of mammalian sexual dimorphism,"['LA Willner', 'RD Martin']",1985,Human sexual dimorphism,
Agents and goals in evolution,['S Okasha'],2018,NA,"Samir Okasha approaches evolutionary biology from a philosophical perspective in Agents and Goals in Evolution, analysing a mode of thinking in biology called agential thinking. He considers how the paradigm case involves treating an evolved organism as if it were an"
Ontogenetic scaling and lithic systematics: method and application,['R Ioviţă'],2009,Journal of Archaeological Science,"Stone tools tend to be classified according to a mix of functional, morphological, and technological attributes. This practice results in confusions when large-scale assemblage comparisons are made with the aim of investigating phylogenetic relationships, as functional"
Genetic constraints on the independent evolution of male and female reproductive characters in the tristylous plant Lythrum salicaria,"[""P O'Neil"", 'J Schmitt']",1993,Evolution,"Here we test whether the potential exists for the independent evolution of allocation to male, female, and attractive functions within a flower. We employed half‐sib and parent‐offspring regression methods in the tristylous plant Lythrum salicaria to determine whether there is"
"Evolution of resistance to a multiple‐herbivore community: genetic correlations, diffuse coevolution, and constraints on the plant's response to selection","['MJ Wise', 'MD Rausher']",2013,Evolution,"Although plants are generally attacked by a community of several species of herbivores, relatively little is known about the strength of natural selection for resistance in multiple‐herbivore communities—particularly how the strength of selection differs among herbivores"
Personality Traits in Rhesus Macaques (Macaca mulatta) Are Heritable but Do Not Predict Reproductive Output,"['LJN Brent', 'S Semple', 'A MacLarnon']",2014,International Journal of …,"There is growing evidence that behavioral tendencies, or “personalities,” in animals are an important aspect of their biology, yet their evolutionary basis is poorly understood. Specifically, how individual variation in personality arises and is subsequently maintained"
"DEVELOPMENT, FUNCTION, AND THE QUANTITATIVE GENETICS OF WING MELANIN PATTERN IN PIERIS BUTTERFLIES","['JG Kingsolver', 'DC Wiernasz']",1991,Evolution,"Do genetic correlations among phenotypic characters reflect developmental organization or functional coadaptation of the characters? We test these hypotheses for the wing melanin pattern of Pieris occidentalis butterflies, by comparing estimated genetic correlations among"
Microevolution in Relation to Macroevolution-Macroevolution: Pattern and Process. Steven M. Stanley WH Freeman and Co.; San Francisco. 1979. xi+ 332 pp. $22.50.,['R Lande'],1980,Paleobiology,"Macroevolution is the most comprehensive text written by a paleontologist since Simpson's The  Major Features of Evolution (1953). In ten chapters Stanley covers the topics of speciation  mechanisms, rates of extinction and speciation, and the controls of organic diversity. A wealth"
"Scaling, selection, and evolutionary dynamics of the mitotic spindle","['R Farhadifar', 'CF Baer', 'AC Valfort', 'EC Andersen']",2015,Current biology,"Background Cellular structures such as the nucleus, Golgi, centrioles, and spindle show remarkable diversity between species, but the mechanisms that produce these variations in cell biology are not known. Results Here we investigate the mechanisms that contribute to"
Morphological variation and sexual dimorphism of the cephalic scales in Lacerta bilineata,"['E Bruner', 'D Costantini', 'A Fanfani', ""G Dell'Omo""]",2005,Acta zoologica,"The Western green lizard (Lacerta bilineata) is a lacertid distributed throughout Mediterranean and Central Europe. Little is known about the morphological variability and sexual shape differences in this species. In this paper, the variation of the cephalic scales in"
Evolutionary response to selection on clutch size in a long-term study of the mute swan,"['A Charmantier', 'C Perrins', 'RH McCleery']",2006,The American …,"Life-history traits in wild populations are often regarded as being subject to directional selection, and the existence of substantial variation and microevolutionary stasis of these characters is therefore a problem in need of explanation. Avian clutch size is an archetypal"
Selection on reproductive characters: floral morphology in Asclepias syriaca,"['MT Morgan', 'DJ Schoen']",1997,Heredity,"Pollinia insertions and removals represent a convenient index of male and female fertilities in the Asclepiadaceae. This fact, in conjunction with regression analysis, allows estimation and comparison of gender-specific selection acting on floral characters in Asclepias syriaca"
Rapid and unpredictable changes of the G‐matrix in a natural bird population over 25 years,"['M Björklund', 'A Husby']",2013,Journal of evolutionary …,"Knowledge of the genetic variances and covariances of traits (the G‐matrix) is fundamental for the understanding of evolutionary dynamics of populations. Despite its essential importance in evolutionary studies, empirical tests of the temporal stability of the G"
Regional approaches to the investigation of past human biocultural structure,"['LW Konigsberg', 'JE Buikstra']",1995,Regional approaches to mortuary analysis,The enormously influential volume by Brown (1971) arising out of the Social Dimensions of Mortuary Practices symposium clearly established that bioanthropological data are essential in assessing and analyzing the social persona of the deceased (Binford 1971: 17). For that
The effect of novel environment and sex on the additive genetic variation and covariation in and between emergence body weight and development period in the …,"['J Guntrip', 'RM Sibly', 'GJ Holloway']",1997,Heredity,"Progeny from full-sib/half-sib families of a population of Callosobruchus maculatus near genetic equilibrium were reared either in an ancestral (30 C, 70 per cent relative humidity) or in a novel (25 C, 45 per cent relative humidity) environment. The life history traits"
The evolution of male genitalia: patterns of genetic variation and covariation in the genital sclerites of the dung beetle Onthophagus taurus,"['CM House', 'LW Simmons']",2005,Journal of evolutionary biology,"Three main hypotheses, have been invoked to explain divergent genital evolution, the lock and key, pleiotropy, and sexual selection hypotheses, each of which make different predictions about how genital traits are inherited. Here we used a half‐sib breeding design"
Effective size of fluctuating populations with two sexes and overlapping generations,"['S Engen', 'TH Ringsby', 'BE Sæther', 'R Lande']",2007,…,We derive formulas that can be applied to estimate the effective population size Ne for organisms with two sexes reproducing once a year and having constant adult mean vital rates independent of age. Temporal fluctuations in population size are generated by
"Brain evolution and development: adaptation, allometry and constraint","['SH Montgomery', 'NI Mundy']",2016,Proceedings of the …,"Phenotypic traits are products of two processes: evolution and development. But how do these processes combine to produce integrated phenotypes? Comparative studies identify consistent patterns of covariation, or allometries, between brain and body size, and between"
Why it is hard to find genes associated with social science traits: Theoretical and empirical considerations,"['CF Chabris', 'JJ Lee', 'DJ Benjamin']",2013,… journal of public …,Objectives. We explain why traits of interest to behavioral scientists may have a genetic architecture featuring hundreds or thousands of loci with tiny individual effects rather than a few with large effects and why such an architecture makes it difficult to find robust
Analysis of litter size and average litter weight in pigs using a recursive model,"['L Varona', 'D Sorensen', 'R Thompson']",2007,Genetics,An analysis of litter size and average piglet weight at birth in Landrace and Yorkshire using a standard two-trait mixed model (SMM) and a recursive mixed model (RMM) is presented. The RMM establishes a one-way link from litter size to average piglet weight. It is shown that
Kin selection in the annual plant Impatiens capensis,['JK Kelly'],1996,The American Naturalist,"Kin selection occurs when phenotypic variation in a character or set of characters is heritable, spatially structured, and has differential fitness effects on neighboring individuals. Spatially structured, heritable variation has been found for many characters of the annual"
Morphological variation and female reproductive success in two sympatric Trillium species: evidence for phenotypic selection in Trillium erectum and Trillium …,['RE Irwin'],2000,American Journal of Botany,"I investigated the mating systems and phenotypic variation of two sympatric spring ephemerals, Trillium erectum and T. grandiflorum (Liliaceae), and phenotypic selection acting through female reproductive success for 11 morphological characters in five"
Quantitative genetic models and the evolution of pesticide resistance,['S Via'],1986,Pesticide resistance: strategies and tactics for …,"When tolerance to pesticides varies continuously among individuals, a quantitative genetic approach to resistance evolution is more useful than is the usual single-locus view. Relative characteristics of polygenic and single-gene resistance are described; then the evolution of"
Genetic correlations: the quantitative genetics of evolutionary constraints,['AG Clark'],1987,Genetic constraints on adaptive evolution,"Dictionary definitions of “constraint” generally indicate some aspect of restricting or confining the possible states or actions of individuals or systems. In the disciplines of linear and dynamic programming, a constraint is a function or inequality specifying the range of"
Evolution of environmental cues for phenotypic plasticity,"['LM Chevin', 'R Lande']",2015,Evolution,"Phenotypically plastic characters may respond to multiple variables in their environment, but the evolutionary consequences of this phenomenon have rarely been addressed theoretically. We model the evolution of linear reaction norms in response to several"
"Estimating the variation, autocorrelation, and environmental sensitivity of phenotypic selection","['LM Chevin', 'ME Visser', 'J Tufto']",2015,Evolution,"Despite considerable interest in temporal and spatial variation of phenotypic selection, very few methods allow quantifying this variation while correctly accounting for the error variance of each individual estimate. Furthermore, the available methods do not estimate the"
The B‐matrix harbors significant and sex‐specific constraints on the evolution of multicharacter sexual dimorphism,"['TP Gosden', 'KL Shastri', 'P Innocenti']",2012,… Journal of Organic …,The extent to which sexual dimorphism can evolve within a population depends on an interaction between sexually divergent selection and constraints imposed by a genetic architecture that is shared between males and females. The degree of constraint within a
Short‐term evolution in the size and shape of pea aphids,"['S Via', 'AJ Shaw']",1996,Evolution,"Phenotypic evolution in contemporary populations can generally be witnessed only when novel selective forces produce rapid evolution. Examples of conditions that have led to rapid evolution include drastic environmental change, invasion of a new predator, or a host‐range"
"Age, Size, and Spatiotemporal Variation in Ovulation Patterns of a Seasonal Breeder, the Norwegian Moose (Alces alces)","['M Garel', 'EJ Solberg', 'BE Sæther']",2009,The American …,"In seasonal environments, timing of reproduction is an important fitness component. However, in ungulates, our understanding of this biological process is limited. Here we analyze how age and body mass affect spatiotemporal variation in timing of ovulation of"
