title,author,pub_year,venue,abstract
mvmorph: an r package for fitting multivariate evolutionary models to morphometric data,"['J Clavel', 'G Escarguel']",2015,Methods in Ecology and …,"We present mvmorph, a package of multivariate phylogenetic comparative methods for the r statistical environment. mvmorph is freely available on the cran package repository (http://cran. r-project. org/web/packages/mvMORPH/). mvmorph allows fitting a range of"
Phytophagous insect–microbe mutualisms and adaptive evolutionary diversification,"['EM Janson', 'JO Stireman III', 'MS Singer']",2008,… International Journal of …,"Adaptive diversification is a process intrinsically tied to species interactions. Yet, the influence of most types of interspecific interactions on adaptive evolutionary diversification remains poorly understood. In particular, the role of mutualistic interactions in shaping"
"Genetic basis of activity metabolism. I. Inheritance of speed, stamina, and antipredator displays in the garter snake Thamnophis sirtalis",['T Garland Jr'],1988,Evolution,Recent conceptual advances in physiological ecology emphasize the potential selective importance of whole‐animal performance. Empirical studies of locomotor performance in reptiles have revealed surprising amounts of individual variation in speed and stamina. The
The evolution of modularity in the mammalian skull II: evolutionary consequences,"['G Marroig', 'LT Shirai', 'A Porto', 'FB de Oliveira']",2009,Evolutionary …,"Changes in patterns and magnitudes of integration may influence the ability of a species to respond to selection. Consequently, modularity has often been linked to the concept of evolvability, but their relationship has rarely been tested empirically. One"
Cranial integration and modularity: insights into evolution and development from morphometric data,['CP Klingenberg'],2013,"Hystrix, the Italian Journal of …",Morphological integration and modularity have become central concepts in evolutionary biology and geometric morphometrics. This review summarizes the most frequently used methods for characterizing and quantifying integration and modularity in morphometric data
Expected time for random genetic drift of a population between stable phenotypic states,['R Lande'],1985,Proceedings of the National Academy of …,"Natural selection and random genetic drift are modeled by using diffusion equations for the mean phenotype of a quantitative (polygenic) character in a finite population with two available adaptive zones or ecological niches. When there is appreciable selection, the"
Ecology of host-selection behavior in phytophagous insects,['MD Rausher'],1983,Variable plants and herbivores in natural and …,"It has long been recognized that phytophagous insects can be highly selective with respect to the plants they consume (Brues, 1920, 1924; Dethier, 1941, 1954; Fraenkel, 1956) and that both the degree of selectivity and the identity of preferred plants can change during an"
Were neandertal and modern human cranial differences produced by natural selection or genetic drift?,"['TD Weaver', 'CC Roseman', 'CB Stringer']",2007,Journal of human evolution,Most evolutionary explanations for cranial differences between Neandertals and modern humans emphasize adaptation by natural selection. Features of the crania of Neandertals could be adaptations to the glacial climate of Pleistocene Europe or to the high mechanical
The danger of applying the breeder's equation in observational studies of natural populations,"['MB Morrissey', 'LEB Kruuk']",2010,Journal of evolutionary …,"The breeder's equation, which predicts evolutionary change when a phenotypic covariance exists between a heritable trait and fitness, has provided a key conceptual framework for studies of adaptive microevolution in nature. However, its application requires strong"
Exploring complex fitness surfaces: multiple ornamentation and polymorphism in male guppies,"['MW Blows', 'R Brooks', 'PG Kraft']",2003,Evolution,"The sexual ornamentation used by male guppies to attract females comprises many components, each of which varies considerably among males. Although natural and sexual selection have been shown to contribute to divergence among populations in male sexual"
Encephalization is not a universal macroevolutionary phenomenon in mammals but is associated with sociality,"['S Shultz', 'R Dunbar']",2010,… of the National Academy of Sciences,"Evolutionary encephalization, or increasing brain size relative to body size, is assumed to be a general phenomenon in mammals. However, despite extensive evidence for variation in both absolute and relative brain size in extant species, there have been no explicit tests of"
"Long‐term correlated response, interpopulation covariation, and interspecific allometry",['ZB Zeng'],1988,Evolution,"A model of long‐term correlated evolution of multiple quantitative characters is analyzed, which partitions selection into two components: one stabilizing and the other directional. The model assumes that the stabilizing component is less variable than the directional"
Evolution of niche width and adaptive diversification,"['M Ackermann', 'M Doebeli']",2004,Evolution,"Theoretical models suggest that resource competition can lead to the adaptive splitting of consumer populations into diverging lineages, that is, to adaptive diversification. In general, diversification is likely if consumers use only a narrow range of resources and thus have a"
Evolutionary game theory and adaptive dynamics of continuous traits,"['BJ McGill', 'JS Brown']",2007,Annu. Rev. Ecol. Evol. Syst.,Continuous-trait game theory fills the niche of enabling analytically solvable models of the evolution of biologically realistically complex traits. Game theory provides a mathematical language for understanding evolution by natural selection. Continuous-trait game theory
Life history patterns in birds and mammals and their evolutionary interpretation,"['D Western', 'J Ssemakula']",1982,Oecologia,"It is argued that allometric principles account for most of the observed variation in the life history patterns amongst birds. To test this contention it is shown that traits such as incubation time, growth rates, age at first reproduction, lifespan, clutch weight and egg"
Evolutionary conservation biology,"['R Ferrière', 'U Dieckmann', 'D Couvet']",2004,NA,"As anthropogenic environmental changes spread and intensify across the planet, conservation biologists have to analyze dynamics at large spatial and temporal scales. Ecological and evolutionary processes are then closely intertwined. In particular"
Modeling genetic architecture: a multilinear theory of gene interaction,"['TF Hansen', 'GP Wagner']",2001,Theoretical population biology,The map from genotype to phenotype is an exceedingly complex function of central importance in biology. In this work we derive and analyze a mathematically tractable model of the genotype–phenotype map that allows for any order of gene interaction. By assuming
Phenotypic covariance structure in tamarins (genus Saguinus): a comparison of variation patterns using matrix correlation and common principal component analysis,"['RR Ackermann', 'JM Cheverud']",2000,American Journal of Physical …,Constancy of variation/covariation structure among populations is frequently assumed in order to measure the differential selective forces which have caused population differentiation through evolutionary time. Following Steppan ([1997] Evolution 51: 571–594)
"Explaining phenotypic selection on plant attractive characters: male function, gender balance or ecological context?","['TL Ashman', 'MT Morgan']",2004,… of the Royal Society of London …,"It is widely agreed that the flowers of hermaphrodite plants evolve in response to selection acting simultaneously through male and female sexual functions, but we know very little about the pattern of gender–specific selection. We review three current hypotheses for"
Evolutionary dynamics of predator-prey systems: an ecological perspective,"['P Marrow', 'U Dieckmann', 'R Law']",1996,Journal of mathematical biology,"Evolution takes place in an ecological setting that typically involves interactions with other organisms. To describe such evolution, a structure is needed which incorporates the simultaneous evolution of interacting species. Here a formal framework for this purpose is"
A critique of methods for measuring life history trade‐offs,"['CM Pease', 'JJ Bull']",1988,Journal of Evolutionary Biology,"Constraints have important effects on the evolution of life history strategies, but several difficulties have been encountered in determining constraints empirically. Here we investigate methods for measuring a specific type of constraint known as a trade‐off. A trade"
The genetic analysis of age-dependent traits: modeling the character process,"['SD Pletcher', 'CJ Geyer']",1999,Genetics,"The extension of classical quantitative genetics to deal with function-valued characters (also called infinite-dimensional characters) such as growth curves, mortality curves, and reaction norms, was begun by Kirkpatrick and co-workers. In this theory, the analogs of variance"
Dynamics of polygenic characters under selection,"['M Turelli', 'NH Barton']",1990,Theoretical Population Biology,Selection on polygenic characters is generally analyzed by statistical methods that assume a Gaussian (normal) distribution of breeding values. We present an alternative analysis based on multilocus population genetics. We use a general representation of selection
Brain size allometry ontogeny and phylogeny,"['RD Martin', 'PH Harvey']",1985,Size and scaling in primate biology,"Interspecific allometric analysis rests upon the assumption that individual characteristics typically change in a regular, predictable fashion with body size according to some recognizable scaling principle, unless special adaptation has led to fundamental"
The handicap mechanism of sexual selection does not work,['M Kirkpatrick'],1986,The American Naturalist,"Zahavi (1975) proposed the handicap hypothesis for the adaptive evolution of female mating preferences and sexual selection that involves the joint evolution of a male secondary sexual character (the"" handicap""), mating preferences for that character, and a third trait that"
Genetic covariance between oviposition preference and larval performance in an insect herbivore,['S Via'],1986,Evolution,An experimental study determined that females of the herbivorous fly species Liriomyza sativae (Diptera: Agromyzidae) preferentially oviposit on the plant species on which their female progeny attain the greatest pupal weight. A modified parent/offspring regression was
"HIERARCHICAL COMPARISON OF GENETIC VARIANCE‐COVARIANCE MATRICES. II COASTAL‐INLAND DIVERGENCE IN THE GARTER SNAKE, THAMNOPHIS …","['SJ Arnold', 'PC Phillips']",1999,Evolution,"The time‐scale for the evolution of additive genetic variance‐covariance matrices (G‐matrices) is a crucial issue in evolutionary biology. If the evolution of G‐matrices is slow enough, we can use standard multivariate equations to model drift and selection response"
Evolutionary consequences of fishing and their implications for salmon,"['JJ Hard', 'MR Gross', 'M Heino', 'R Hilborn']",2008,Evolutionary …,We review the evidence for fisheries‐induced evolution in anadromous salmonids. Salmon are exposed to a variety of fishing gears and intensities as immature or maturing individuals. We evaluate the evidence that fishing is causing evolutionary changes to traits including
"Multi-trait selection, adaptation, and constraints on the evolution of burst swimming performance","['CK Ghalambor', 'JA Walker']",2003,… and comparative biology,"Whole organism performance represents the integration of numerous physiological, morphological, and behavioral traits. How adaptive changes in performance evolve therefore requires an understanding of how selection acts on multiple integrated traits. Two"
Directional selection in temporally replicated studies is remarkably consistent,"['MB Morrissey', 'JD Hadfield']",2012,Evolution: International Journal of …,Temporal variation in selection is a fundamental determinant of evolutionary outcomes. A recent paper presented a synthetic analysis of temporal variation in selection in natural populations. The authors concluded that there is substantial variation in the strength and
The evolution of the G matrix: selection or drift?,['D Roff'],2000,Heredity,"The evolution of quantitative characters can be described by the equation Δz¯= GP− 1S where Δz¯ is the vector of mean responses, G is the matrix of additive genetic variances and covariances, P is the matrix of phenotypic variances and covariances and S is the vector of"
The spatial patterns of directional phenotypic selection,"['AM Siepielski', 'KM Gotanda', 'MB Morrissey']",2013,Ecology …,"Local adaptation, adaptive population divergence and speciation are often expected to result from populations evolving in response to spatial variation in selection. Yet, we lack a comprehensive understanding of the major features that characterise the spatial patterns of"
Natural selection drives patterns of lake–stream divergence in stickleback foraging morphology,"['D Berner', 'DC Adams', 'AC Grandchamp']",2008,Journal of …,To what extent are patterns of biological diversification determined by natural selection? We addressed this question by exploring divergence in foraging morphology of threespine stickleback fish inhabiting lake and stream habitats within eight independent watersheds
Estimating evolutionary parameters when viability selection is operating,['JD Hadfield'],2008,Proceedings of the Royal Society B …,"Some individuals die before a trait is measured or expressed (the invisible fraction), and some relevant traits are not measured in any individual (missing traits). This paper discusses how these concepts can be cast in terms of missing data problems from statistics. Using"
Aspects of size and scaling in primate biology with special reference to the locomotor skeleton,['WL Jungers'],1984,American Journal of Physical Anthropology,Scaling refers to the structural and functional consequences of differences in size (or scale) among organisms of more or less similar design. Investigations into such size‐related phenomena in primates continue to be a primary concern of physical anthropologists
The role of epistatic gene interactions in the response to selection and the evolution of evolvability,"['AJR Carter', 'J Hermisson', 'TF Hansen']",2005,Theoretical population biology,"It has been argued that the architecture of the genotype–phenotype map determines evolvability, but few studies have attempted to quantify these effects. In this article we use the multilinear epistatic model to study the effects of different forms of epistasis on the"
Sexual selection in complex environments,"['CW Miller', 'EI Svensson']",2014,Annual Review of Entomology,"Sexual selection has resulted in some of the most captivating features of insects, including flashy colors, bizarre structures, and complex pheromones. These features evolve in dynamic environments, where conditions can change rapidly over space and time. However"
Evolutionary constraints on adaptive evolution during range expansion in an invasive plant,"['RI Colautti', 'CG Eckert']",2010,Proceedings of the …,"Biological invasions may expose populations to strong selection for local adaptation along geographical gradients in climate. However, evolution during contemporary timescales can be constrained by low standing genetic variation and genetic correlations among life-history"
Correlational selection leads to genetic integration of body size and an attractive plumage trait in dark‐eyed juncos,"['JW McGlothlin', 'PG Parker', 'V Nolan', 'ED Ketterson']",2005,Evolution,"When a trait's effect on fitness depends on its interaction with other traits, the resultant selection is correlational and may lead to the integration of functionally related traits. In relation to sexual selection, when an ornamental trait interacts with phenotypic quality to"
Measuring selection in contemporary human populations,"['SC Stearns', 'SG Byars', 'DR Govindaraju']",2010,Nature Reviews …,"Are humans currently evolving? This question can be answered using data on lifetime reproductive success, multiple traits and genetic variation and covariation in those traits. Such data are available in existing long-term, multigeneration studies—both clinical and"
Artificial sexual selection alters allometry in the stalk-eyed fly Cyrtodiopsis dalmanni (Diptera: Diopsidae),['GS Wilkinson'],1993,Genetics Research,Selection for increased and decreased ratio of eye span to body length was exerted on male stalk-eyed flies (Cyrtodiopsis dalmanni) from Malaysia using replicate selected and unselected lines. Response to selection was symmetrical. After 10 generations high line
Adaptationism and optimality,"['SH Orzack', 'E Sober', 'S Orzack', 'M Ruse']",2001,NA,The debate over the relative importance of natural selection as compared to other forces affecting the evolution of organisms is a long-standing and central controversy in evolutionary biology. The theory of adaptationism argues that natural selection contains
"Developmental constraints, modules, and evolvability",['CP Klingenberg'],2005,Variation,This chapter discusses the developmental origins and evolutionary implications of covariation between traits. These are important factors influencing the evolutionary potential of morphological traits. Strong covariation can constitute an evolutionary constraint because
The dynamics of peak shifts and the pattern of morphological evolution,['R Lande'],1986,Paleobiology,"Recent theoretical results demonstrate that a phenotypic version of Wright's shifting balance theory generates the dynamical pattern of punctuated equilibria. Thus, classical mechanisms of random genetic drift and selection for multiple adaptive peaks produce"
Evolution of plant resistance to multiple herbivores: quantifying diffuse coevolution,"['K Iwao', 'MD Rausher']",1997,The American Naturalist,"Studies of coevolution in plant-herbivore systems have typically focused on tight, pairwise interactions between one herbivore and one host plant species. Diffuse coevolution, by contrast, has received much less empirical attention, presumably because imprecise"
Comparative tests of primate cognition: different scaling methods produce different results,"['RO Deaner', 'CL Nunn', 'CP van Schaik']",2000,"Brain, Behavior and Evolution","Although early comparative studies supported hypotheses that ecological demands selected for primate cognition, later work indicated that social demands were more important. One difference between earlier and later studies is that earlier studies scaled brain structures by"
"The genetic correlation between characters maintained by selection, linkage and inbreeding",['R Lande'],1984,Genetics Research,"Mutation is modelled in two quantitative characters under separate genetic control in a large population. A bivariate pattern of selection acts to correlate the characters and, without pleiotropy, their genetic correlation is due entirely to linkage disequilibrium. Data on"
The measurement of form and variation in form: An application of three‐dimensional quantitative morphology by finite‐element methods,"['J Cheverud', 'JL Lewis', 'W Bachrach']",1983,American Journal of …,"D'Arcy Thompson developed a method of coordinates which allowed for a geometrical presentation of form and form change. While his grid transformations have received much attention, little work in the geometry of form and form change has occurred since. We present"
The mutation matrix and the evolution of evolvability,"['AG Jones', 'SJ Arnold', 'R Bürger']",2007,… : International Journal of …,"Evolvability is a key characteristic of any evolving system, and the concept of evolvability serves as a unifying theme in a wide range of disciplines related to evolutionary theory. The field of quantitative genetics provides a framework for the exploration of evolvability with the"
Evolutionary paths underlying flower color variation in Antirrhinum,"['AC Whibley', 'NB Langlade', 'C Andalo', 'AI Hanna']",2006,…,"To understand evolutionary paths connecting diverse biological forms, we defined a three-dimensional genotypic space separating two flower color morphs of Antirrhinum. A hybrid zone between morphs showed a steep cline specifically at genes controlling flower color"
Net evolutionary trajectories of body shape evolution within a microgeographic radiation of threespine sticklebacks (Gasterosteus aculeatus),"['JA Walker', 'MA Bell']",2000,Journal of Zoology,"Following deglaciation of the Cook Inlet region of Alaska approximately 16 000 years ago, anadromous threespine stickleback (Gasterosteus aculeatus) rapidly colonized emerging lakes and rivers forming resident, freshwater populations. Although the precise body shape"
A nonracial craniofacial perspective on human variation: A (ustralia) to Z (uni),"['CL Brace', 'KD Hunt']",1990,American Journal of Physical …,"Dental and craniofacial measurements were collected for 57 samples from Asia, the Pacific, the aboriginal western hemisphere, and Europe. The craniofacial dimensions include many that are not obviously under the control of specific selective forces. Similar configurations for"
Mapping genes that modulate mouse brain development: a quantitative genetic approach,['RW Williams'],2000,Mouse brain development,"The complexity of CNS development is staggering. In mice a total of approximately 75 million neurons and 25 million glial cells are generated, moved, connected, and integrated into hundreds of different circuits over a period of 1 month. The process is coordinated by the"
7 The evolutionary ecology of the,['R BARTON'],2001,Comparative primate socioecology,Comparative studies of the brain have long intrigued and frustrated researchers. They have intrigued because of what they might reveal about the evolutionary forces shaping cognitive attributes. They have frustrated because the results have been so difficult to interpret
The genetic architecture of ecological specialization: correlated gene effects on host use and habitat choice in pea aphids,"['S Via', 'DJ Hawthorne']",2002,the american naturalist,"Genetic correlations among phenotypic characters result when two traits are influenced by the same genes or sets of genes. By reducing the degree to which traits in two environments can evolve independently (eg, Lande; Via and Lande), such correlations are likely to play a"
Evolution and stability of the G‐matrix on a landscape with a moving optimum,"['AG Jones', 'SJ Arnold', 'R Burger']",2004,Evolution,"In quantitative genetics, the genetic architecture of traits, described in terms of variances and covariances, plays a major role in determining the trajectory of evolutionary change. Hence, the genetic variance‐covariance matrix (G‐matrix) is a critical component of modern"
"Variation, selection and evolution of function-valued traits","['JG Kingsolver', 'R Gomulkiewicz', 'PA Carter']",2001,"Microevolution rate, pattern …","We describe an emerging framework for understanding variation, selection and evolution of phenotypic traits that are mathematical functions. We use one specific empirical example-thermal performance curves (TPCs) for growth rates of caterpillars-to demonstrate how"
Selective sweep at a quantitative trait locus in the presence of background genetic variation,"['LM Chevin', 'F Hospital']",2008,Genetics,"We model selection at a locus affecting a quantitative trait (QTL) in the presence of genetic variance due to other loci. The dynamics at the QTL are related to the initial genotypic value and to the background genetic variance of the trait, assuming that background genetic"
Spontaneous mutations for life‐history characters in an obligate parthenogen,['M Lynch'],1985,Evolution,"By allowing mutations to accumulate spontaneously in different lines derived from a single female of an obligately parthenogenetic Daphnia, it has become possible to estimate the rate at which new genetic variance for life‐history characters arises as well as to identify the"
Taxonomic differences in the scaling of brain on body weight among mammals,"['MD Pagel', 'PH Harvey']",1989,Science,"Theories for the evolution of brain weight in mammals suggest that closely related species have diverged largely as a result of selection for differences in body weight, but that differences among more distantly related species have arisen due to greater net directional"
"Inbreeding–lessons from animal breeding, evolutionary biology and conservation genetics","['TN Kristensen', 'AC Sørensen']",2005,Animal Science,"Increased rates of inbreeding are one side effect of breeding programmes designed to give genetic progress for traits of economic importance in livestock. Inbreeding leads to inbreeding depression for traits showing dominance, and will ultimately lead to a decrease"
QUANTITATIVE GENETICS OF MORPHOLOGICAL DIFFERENTIATION IN PEROMYSCUS. I. TESTS OF THE HOMOGENEITY OF GENETIC COVARIANCE …,['D Lofsvold'],1986,Evolution,"Phenotypic and additive genetic covariance matrices were estimated for 15 morphometric characters in three species and subspecies of Peromyscus. Univariate and multivariate ANOVAs indicate these groups are highly diverged in all characters, P. leucopus having the"
