title,author,pub_year,counts
"Fitness and adaptation in a novel environment: effect of inbreeding, prior environment, and lineage","['DH Reed', 'EH Lowe', 'DA Briscoe', 'R Frankham']",2003.0,1
Genetic architecture and evolutionary constraint when the environment contains genes,['JB Wolf'],2003.0,1
Genetic damage and the molecular/cellular response to pollution,"['MP Cajaraville', 'L Hauser', 'G Carvalho']",2003.0,1
"Genetic variability at neutral markers, quantitative trait loci and trait in a subdivided population under selection","['V Le Corre', 'A Kremer']",2003.0,1
Genetic variation of polygenic characters and the evolution of genetic degeneracy,['SA Frank'],2003.0,1
Heritable genetic variation and potential for adaptive evolution in asexual aphids (Aphidoidea),"['ACC Wilson', 'P Sunnucks']",2003.0,1
Mathematical analysis of a model describing evolution of an asexual population in a changing environment,"['M Broom', 'Q Tang', 'D Waxman']",2003.0,1
Mixed-model reanalysis of primate data suggests tissue and species biases in oligonucleotide-based gene expression profiles,"['WP Hsieh', 'TM Chu', 'RD Wolfinger', 'G Gibson']",2003.0,1
Non-equivalent loci and mutation–selection balance,"['D Waxman', 'J Welch']",2003.0,1
On the persistence and pervasiveness of a new mutation,"['A Garcia‐Dorado', 'A Caballero', 'JF Crow']",2003.0,1
Performance surfaces and adaptive landscapes,['SJ Arnold'],2003.0,1
Phase transitions in sexual populations subject to stabilizing selection,['A Rogers'],2003.0,1
Quantitative molecular genetics of longevity in Drosophila melanogaster,['GLG Thornsberry'],2003.0,1
Small fitness effects and weak genetic interactions between deleterious mutations in heterozygous loci of the yeast Saccharomyces cerevisiae,"['K Szafraniec', 'DM Wloch', 'P Sliwa', 'RH Borts']",2003.0,1
Spatial arrangement of genetic variation in the marine bivalve Macoma balthica (L.),['PC Luttikhuizen'],2003.0,1
Spatially structured genetic variation in a broadcast spawning bivalve: quantitative vs. molecular traits,"['PC Luttikhuizen', 'J Drent']",2003.0,1
The constancy of the G matrix through species divergence and the effects of quantitative genetic constraints on phenotypic evolution: a case study in crickets,"['M Bégin', 'DA Roff']",2003.0,1
The contribution of spontaneous mutation to variation in environmental response in Arabidopsis thaliana: responses to nutrients,"['SM Chang', 'RG Shaw']",2003.0,1
The dynamic clonal genome and its adaptive potential,"['G Lushai', 'HD Loxdale', 'JA Allen']",2003.0,1
The role of phenotypic plasticity in driving genetic evolution,"['TD Price', 'A Qvarnström']",2003.0,1
The two-locus model of Gaussian stabilizing selection,"['M Willensdorfer', 'R Bürger']",2003.0,1
Virulence evolution and the timing of disease life-history events,['T Day'],2003.0,1
A comprehensive model of mutations affecting fitness and inferences for Arabidopsis thaliana,"['FH Shaw', 'CJ Geyer', 'RG Shaw']",2002.0,1
A model of population genetics and its mathematical relation to quantum theory,['D Waxman'],2002.0,1
A statistical test of unbiased evolution of body size in birds,['F Bokma'],2002.0,1
Accumulation of deleterious mutations: additional Drosophila melanogaster estimates and a simulation of the effects of selection,"['A Caballero', 'E Cusi', 'C Garcia', 'A García‐Dorado']",2002.0,1
Adaptive constraints and the phylogenetic comparative method: a computer simulation test,"['EP Martins', 'JAF Diniz‐Filho', 'EA Housworth']",2002.0,1
Adaptive divergence and the balance between selection and gene flow: lake and stream stickleback in the Misty system,"['AP Hendry', 'EB Taylor', 'JD McPhail']",2002.0,1
Association of single-nucleotide polymorphisms at the Delta locus with genotype by environment interaction for sensory bristle number in Drosophila melanogaster,"['GL Geiger-Thornsberry', 'TFC Mackay']",2002.0,1
Comparing gmatrices: a MANOVA approach,['D Roff'],2002.0,1
Contemporary fisherian life-history evolution in small salmonid populations,"['MT Koskinen', 'TO Haugen', 'CR Primmer']",2002.0,1
Controllability of selection–mutation systems,"['A Scarelli', 'Z Varga']",2002.0,1
Correlational selection and the evolution of genomic architecture,"['B Sinervo', 'E Svensson']",2002.0,1
Current conservation genetics: building an ecological approach to the synthesis of molecular and quantitative genetic methods,['P Moran'],2002.0,1
Dynamics of bacterial phenotype selection in a colonized host,"['GF Webb', 'MJ Blaser']",2002.0,1
Evolutionary optimisation models and matrix games in the unified perspective of adaptive dynamics,"['G Meszena', 'E Kisdi', 'U Dieckmann', 'SAH Geritz']",2002.0,1
Evolutionary speed of species invasions,"['G García-Ramos', 'D Rodríguez']",2002.0,1
Genetic studies of population history and contemporary microevolution in grayling (Thymallus: Salmonidae),['MT Koskinen'],2002.0,1
Local adaptation and the geometry of host–parasite coevolution,['S Gandon'],2002.0,1
"On the Breeding of “CSR18CSR19”- A Robust Bivoltine Hybrid of Silkworm, Bombyx mori L. for the Tropics","['NS Kumar', 'HK Basavaraja', 'CM Kumar']",2002.0,1
"On the Breeding of"" CSR18 x CSR19""-A Robust Bivoltine Hybrid of Silkworm, Bombyx mori L. for the Tropics","['HK Basavaraja', 'N MalReddy']",2002.0,1
Pleiotropic model of maintenance of quantitative genetic variation at mutation-selection balance,"['XS Zhang', 'J Wang', 'WG Hill']",2002.0,1
Properties of spontaneous and induced mutations in Caenorhabditis elegans,['SR Estes'],2002.0,1
Selection in captivity during supportive breeding may reduce fitness in the wild,['MJ Ford'],2002.0,1
Sex-biased hatching order and adaptive population divergence in a passerine bird,"['AV Badyaev', 'GE Hill', 'ML Beck', 'AA Dervan']",2002.0,1
Sexual selection driving diversification in jumping spiders,"['SE Masta', 'WP Maddison']",2002.0,1
The evolution of trade‐offs: testing predictions on response to selection and environmental variation,"['DA Roff', 'S Mostowy', 'DJ Fairbairn']",2002.0,1
The genetic architecture of Drosophila sensory bristle number,"['CL Dilda', 'TFC Mackay']",2002.0,1
The population viability assessment workshop: A tool for threatened species management,"['TW Clark', 'GN Backhouse']",2002.0,1
The structure of evolutionary theory,['SJ Gould'],2002.0,1
"Time-averaging, evolution, and morphologic variation","['AM Bush', 'MG Powell', 'WS Arnold', 'TM Bert', 'GM Daley']",2002.0,1
Understanding quantitative genetic variation,"['NH Barton', 'PD Keightley']",2002.0,1
Variation in Drosophila sensory bristle number at 'Evolution Canyon',"['RF Lyman', 'E Nevo', 'TFC Mackay']",2002.0,1
Adaptationism and optimality,"['SH Orzack', 'E Sober', 'S Orzack', 'M Ruse']",2001.0,1
Adaptive divergence and the evolution of reproductive isolation in the wild: an empirical demonstration using introduced sockeye salmon,['AP Hendry'],2001.0,1
Direct Estimate of the Mutation Rate and the Distribution of Fitness Effects in the Yeast Saccharomyces cerevisiae,"['DM Wloch', 'K Szafraniec', 'RH Borts', 'R Korona']",2001.0,1
Direct and indirect responses to selection on pollen size in Brassica rapa L.,"['TS Sarkissian', 'LD Harder']",2001.0,1
Dynamics of infinite populations evolving in a landscape of uni-and bimodal fitness functions,['I Karcz-Duleba'],2001.0,1
Ecologically and evolutionarily motivated models of fish populations for conservation and management,['SE Ratner'],2001.0,1
Effects of releasing maladapted individuals: a demographic-evolutionary model,['J Tufto'],2001.0,1
Estimates of the Rate and Distribution of Fitness Effects of Spontaneous Mutation in Saccharomyces cerevisiae,"['C Zeyl', 'JAGM DeVisser']",2001.0,1
Fitness and sexual response to population density,"['LM Berg', 'S LSSON', 'M Lascoux']",2001.0,1
Genetic and demographic parameters determining population persistence after a discrete change in the environment,"['EG Boulding', 'T Hay']",2001.0,1
Genetic disequilibria and the interpretation of population genetic structure in Daphnia,['LM Berg'],2001.0,1
Inbreeding Changes the Shape of the Genetic Covariance Matrix in Drosophila melanogaster,"['PC Phillips', 'MC Whitlock', 'K Fowler']",2001.0,1
Microevolutionary forces affecting the incidence of parthenogenesis in Drosophila mercatorum,['MG Kramer'],2001.0,1
Mutational meltdown in laboratory yeast populations,"['C Zeyl', 'M Mizesko', 'JAGM De Visser']",2001.0,1
Population genetics: multilocus,"['M Shpak', 'S Gavrilets']",2001.0,1
Possible consequences of genes of major effect: transient changes in the G-matrix,"['AF Agrawal', 'ED Brodie', 'LH Rieseberg']",2001.0,1
Predicting the evolution of sexual size dimorphism,"['JP Reeve', 'DJ Fairbairn']",2001.0,1
Quantitative trait loci in Drosophila,['TFC Mackay'],2001.0,1
Rates of evolution on the time scale of the evolutionary process,['PD Gingerich'],2001.0,1
Sexual selection and the sex ratio: an ESS analysis,"['I Pen', 'FJ Weissing']",2001.0,1
The accretion model of Neandertal evolution,"['JD Hawks', 'MH Wolpoff']",2001.0,1
The adaptive landscape as a conceptual bridge between micro-and macroevolution,"['SJ Arnold', 'ME Pfrender', 'AG Jones']",2001.0,1
The pace of modern life II: from rates of contemporary microevolution to pattern and process,"['MT Kinnison', 'AP Hendry']",2001.0,1
The population ecology of contemporary adaptations: what empirical studies reveal about the conditions that promote adaptive evolution,"['DN Reznick', 'CK Ghalambor']",2001.0,1
The role of hybridization in evolution,['NH Barton'],2001.0,1
Transposable element number in mixed mating populations,['MT Morgan'],2001.0,1
Using genetic markers to directly estimate male selection gradients,"['MT Morgan', 'JK Conner']",2001.0,1
When sources become sinks: migrational meltdown in heterogeneous habitats,"['O Ronce', 'M Kirkpatrick']",2001.0,1
"Why the null matters: statistical tests, random walks and evolution","['HD Sheets', 'CE Mitchell']",2001.0,1
突变积累实验中极大似然法和距法的比较,['邓红文， 李剑'],2001.0,1
A population genetics model for multiple quantitative traits exhibiting pleiotropy and epistasis,"['CF Taylor', 'PG HIGGS']",2000.0,1
A scalable agent-based network measurement infrastructure,"['YI Wijata', 'D Niehaus', 'VS Frost']",2000.0,1
Age-specific effects of novel mutations in Drosophila melanogaster I. Mortality,"['LY Yampolsky', 'LE Pearse', 'DEL Promislow']",2000.0,1
Brief communication. Does fitness erode in the absence of selection? An experimental test with Tribolium,"['A Lomnicki', 'M Jasienski']",2000.0,1
Co–option of male courtship signals from aggressive display in bowerbirds,"['G Borgia', 'SW Coleman']",2000.0,1
Evolutionary causes of genetic variation in fertility and other fitness components,"['KA Hughes', 'MH Burleson']",2000.0,1
Genetic constraints on the evolution of sexual size dimorphism,['JP Reeve'],2000.0,1
"Interspecific competition, environmental gradients, gene flow, and the coevolution of species' borders","['TJ Case', 'ML Taper']",2000.0,1
Lack of concordance between genetic diversity estimates at the molecular and quantitative-trait levels,"['ME Pfrender', 'K Spitze', 'J Hicks', 'K Morgan', 'L Latta']",2000.0,1
Maintenance of genetic variation in phenotypic plasticity: the role of environmental variation,['S GAVRILETS'],2000.0,1
Micro-and macroevolution: scale and hierarchy in evolutionary biology and paleobiology,['D Jablonski'],2000.0,1
Molecular evolution in a multisite nearly neutral mutation model,['H Tachida'],2000.0,1
Multigeneration maximum-likelihood analysis applied to mutation-accumulation experiments in Caenorhabditis elegans,"['PD Keightley', 'TM Bataillon']",2000.0,1
Population differentiation for adaptive traits and their underlying loci in forest trees: theoretical predictions and experimental results,"['A Kremer', 'V Le Corre', 'S Mariette']",2000.0,1
Population differentiation in an annual legume: genetic architecture,"['CB Fenster', 'LF Galloway']",2000.0,1
Population genetics models with multiple quantitative traits,['CF Taylor'],2000.0,1
Prediction of rates of inbreeding in populations selected on best linear unbiased prediction of breeding value,"['P Bijma', 'JA Woolliams']",2000.0,1
QUANTITATIVE GENETIC VARIATION IN DAPHNIA: TEMPORAL CHANGES IN GENETIC ARCHITECTURE,"['ME Pfrender', 'M Lynch']",2000.0,1
Quantitative Genetics of Growth and Development in the Freshwater Copepod Diaptomus leptopus,"['S Twombly', 'N Tisch']",2000.0,1
Quantitative genetics and the persistence of environmental effects in clonally propagated organisms,"['KE Schwaegerle', 'H McIntyre', 'C Swingley']",2000.0,1
"Roles of selection intensity, major genes, and minor genes in evolution of insecticide resistance","['FR Groeters', 'BE Tabashnik']",2000.0,1
Sexual dimorphism in relation to current selection in the house finch,"['AV Badyaev', 'TE Martin']",2000.0,1
THE ECOLOGY AND GENETICS OF FITNESS IN CHLAMYDOMONAS. IX. THE RATE OF ACCUMULATION OF VARIATION OF FITNESS UNDER SELECTION,"['S Goho', 'G Bell']",2000.0,1
THE FITNESS EFFECTS OF SPONTANEOUS MUTATIONS IN CAENORHABDITIS ELEGANS,"['LL Vassilieva', 'AM Hook', 'M Lynch']",2000.0,1
Temporal uniformity of the spontaneous mutational variance of quantitative traits in Drosophila melanogaster,"['A GARCÍA-DORADO', 'J FERNÁNDEZ']",2000.0,1
"Temporal variation in skull size and shape in the southern brown bandicoot, Isoodon obesulus (Peramelidae: Marsupialia) in Western Australia",['ML Cooper'],2000.0,1
The evolution of predator-prey interactions: theory and evidence,['PA Abrams'],2000.0,1
The evolution of sexual dimorphism in the house finch. I. Population divergence in morphological covariance structure,"['AV Badyaev', 'GE Hill']",2000.0,1
The evolution of thermal sensitivity in changing environments,['GW Gilchrist'],2000.0,1
The limits to knowledge in conservation genetics,['L Nunney'],2000.0,1
The stability of symmetric solutions to polygenic models,"['NH Barton', 'M Shpak']",2000.0,1
Theoretical studies of the interaction between deleterious and beneficial mutations,['T Johnson'],2000.0,1
Variability in Phenotypic Covariance Structure of Female Genitalia in the Brachypterous Grasshopper Podisma sapporensis (Orthoptera: Acrididae: Podisminae),"['H Tatsuta', 'S Akimoto']",2000.0,1
ガンマ線照射によるセイロンベンケイソウの CAM/C3 型光合成突然変異株の作出 (1),['川満芳信， 川元恵子， 渡慶次努'],2000.0,1
第 1 報 急照射の場合 (ガンマ線照射によるセイロンベンケイソウの CAM/C_3 型光合成突然変異株の作出),['川満芳信， 川元恵子， 渡慶次努'],2000.0,1
A model for the coevolution of resistance and virulence in coupled host–parasitoid interactions,"['A Sasaki', 'HCJ Godfray']",1999.0,1
An experimental method for evaluating the contribution of deleterious mutations to quantitative trait variation,['JK Kelly'],1999.0,1
Associations of co-mimetic ithomiine butterflies on small spatial and temporal scales in a neotropical rainforest,"['PJ DeVries', 'R Lande', 'D Murray']",1999.0,1
Desert arthropods: life history variations,['F Punzo'],1999.0,1
Does natural selection alter genetic architecture? An evaluation of quantitative genetic variation among populations of Allenomobius socius and A. fasciatus,"['DA Roff', 'TA Mousseau']",1999.0,1
Ecology and evolution of Darwin's finches,['PR Grant'],1999.0,1
"Epigenetic inheritance, genetic assimilation and speciation","['C Pál', 'I Miklós']",1999.0,1
Estimation of ancestral states of continuous characters: a computer simulation study,['EP Martins'],1999.0,1
FLUX GÉNIQUES CHEZ LES ARBRES FORESTIERS SYNTHÈSE BIBLIOGRAPHIQUE,"['F Austerlitz', 'S Brachet', 'D Couvet', 'N Frascaria-LAcoste']",1999.0,1
"Genetic variation in structured populations space, time and the Red Queen",['KA Lythgoe'],1999.0,1
Geographic Patterns in the Evolution of Resistance and Virulence in Drosophila and Its Parasitoids,"['AR Kraaijeveld', 'HCJ Godfray']",1999.0,1
High-resolution mapping of quantitative trait loci for sternopleural bristle number in Drosophila melanogaster,"['MC Gurganus', 'SV Nuzhdin', 'JW Leips', 'TFC Mackay']",1999.0,1
"Inbreeding load, average dominance and the mutation rate for mildly deleterious alleles in Mimulus guttatus",['JH Willis'],1999.0,1
Morphological integration,"['EC Olson', 'RL Miller']",1999.0,1
"NATURAL GENETIC VARIATION OF LIFE SPAN, REPRODUCTION, AND JUVENILE GROWTH IN DAPHNIA","['JL Dudycha', 'AJ Tessier']",1999.0,1
On the experimental design and data analysis of mutation accumulation experiments,"['HW Deng', 'J Li', 'JL Li']",1999.0,1
On the possibility of constructive neutral evolution,['A Stoltzfus'],1999.0,1
Perspective: the pace of modern life: measuring rates of contemporary microevolution,"['AP Hendry', 'MT Kinnison']",1999.0,1
Plenary address: Conserving adaptive variation in forest ecosystems,['SN Aitken'],1999.0,1
Population divergence and morphometric integration in the greenfinch (Carduelis chloris): evolution against the trajectory of least resistance?,"['J Merilä', 'M Björklund']",1999.0,1
Properties of spontaneous mutations affecting quantitative traits,"['A Garcia-Dorado', 'C López-Fanjul', 'A Caballero']",1999.0,1
Response to selection in partially self‐fertilizing populations. I. Selection on a single trait,['JK Kelly'],1999.0,1
Risk estimation for multifactorial diseases,['J Valentin'],1999.0,1
Sex and adaptation in a changing environment,"['D Waxman', 'JR Peck']",1999.0,1
Species diversity in spatial and temporal dimensions of fruit-feeding butterflies from two Ecuadorian rainforests,"['PJ DeVRIES', 'TR WALLA']",1999.0,1
Spontaneous deleterious mutation in Arabidopsis thaliana,"['ST Schultz', 'M Lynch', 'JH Willis']",1999.0,1
The adaptive dynamics of consumer choice,['PA Abrams'],1999.0,1
"The approach to mutation–selection balance in an infinite asexual population, and the evolution of mutation rates",['T Johnson'],1999.0,1
The effect of overdominance on characterizing deleterious mutations in large natural populations,"['JL Li', 'J Li', 'HW Deng']",1999.0,1
The evolution of age-specific mortality rates in Drosophila melanogaster: genetic divergence among unselected lines,"['SD Pletcher', 'D Houle', 'JW Curtsinger']",1999.0,1
The quantitative and molecular genetic architecture of a subdivided species,"['M Lynch', 'M Pfrender', 'K Spitze', 'N Lehman', 'J Hicks']",1999.0,1
The rate of spontaneous mutation for life-history traits in Caenorhabditis elegans,"['LL Vassilieva', 'M Lynch']",1999.0,1
Using phylogenies to test macroevolutionary hypotheses of trait evolution in cranes (Gruinae),"['AØ Mooers', 'SM Vamosi']",1999.0,1
A general multilocus two-allele model for epistatic selection,"['LA Zhivotovsky', 'KV Pylkov']",1998.0,1
A pleiotropic model of phenotypic evolution,['Y Tanaka'],1998.0,1
An embarrassment of riches: the stochastic generation of beneficial mutations,"['DDG Gessler', 'S Xu']",1998.0,1
Are polymorphism and evolutionary rate of allozyme proteins limited by mutation or selection?,"['DOF Skibinski', 'RD Ward']",1998.0,1
Coevolution of elaborated male display traits in the spotted bowerbird: an experimental test of the threat reduction hypothesis,"['G BORGIA', 'DC PRESGRAVES']",1998.0,1
Differentiation of allelic frequencies at quantitative trait loci affecting locally adaptive traits,['RG Latta'],1998.0,1
Distribution of fitness effects caused by random insertion mutations in Escherichia coli,"['SF Elena', 'L Ekunwe', 'N Hajela', 'SA Oden', 'RE Lenski']",1998.0,1
EMS-induced polygenic mutation rates for nine quantitative characters in Drosophila melanogaster,"['PD Keightley', 'O Ohnishi']",1998.0,1
Effective size and polymorphism of linked neutral loci in populations under directional selection,"['E Santiago', 'A Caballero']",1998.0,1
Evolutionary dynamics of molecular and quantitative genetic variation in ephemeral pond populations of Daphnia pulex,['ME Pfrender'],1998.0,1
Genotype-environment interaction at quantitative trait loci affecting sensory bristle number in Drosophila melanogaster,"['MC Gurganus', 'JD Fry', 'SV Nuzhdin', 'EG Pasyukova']",1998.0,1
Ising quantum chain and sequence evolution,"['H Wagner', 'E Baake', 'T Gerisch']",1998.0,1
Linkage and the maintenance of variation for quantitative traits by mutation–selection balance: an infinitesimal model,['E Santiago'],1998.0,1
Minimum distance estimation of mutational parameters for quantitative traits,"['A Garcia-Dorado', 'JM Marin']",1998.0,1
Modeling the genetic architecture of modern populations,"['ST Sherry', 'MA Batzer']",1998.0,1
Principles of animal communication,"['JW Bradbury', 'SL Vehrencamp']",1998.0,1
Rheotactic response of fry from beach-spawning populations of sockeye salmon: evolution after selection is relaxed,"['JE Hensleigh', 'AP Hendry']",1998.0,1
Spontaneous mutation for life-history traits in Drosophila melanogaster,"['C Martorell', 'MA Toro', 'C Gallego']",1998.0,1
Stabilizing selection and variance in fig wasp sex ratios,"['SA West', 'EA Herre']",1998.0,1
"Système génétique, polymorphisme neutre et sélectionné: implications en biologie de la conservation","['B Godelle', 'F Austerlitz', 'S Brachet', 'B Colas']",1998.0,1
The adaptive surface in ecology,"['KK Fear', 'T Price']",1998.0,1
The fate of competing beneficial mutations in an asexual population,"['PJ Gerrish', 'RE Lenski']",1998.0,1
Evolution of a species' range,"['M Kirkpatrick', 'NH Barton']",1997.0,1
Evolutionary predictability in natural populations: Do mating system and nonadditive genetic variance interact to affect heritabilities in Plantago lanceolata?,"['SJ Tonsor', 'CJ Goodnight']",1997.0,1
Fitness minimization and dynamic instability as a consequence of predator–prey coevolution,"['PA Abrams', 'H Matsuda']",1997.0,1
Genetic diversity for the future: conservation or creation and capture,['RD Burdon'],1997.0,1
Genetic models of adaptation and gene flow in peripheral populations,"['G García‐Ramos', 'M Kirkpatrick']",1997.0,1
Genomic mutation rates for lifetime reproductive output and lifespan in Caenorhabditis elegans,"['PD Keightley', 'A Caballero']",1997.0,1
Hereditarian scientific fallacies,['RC Bailey'],1997.0,1
Non-linear selection response in Drosophila: a strategy for testing the rare-alleles model of quantitative genetic variability,"['JW Curtsinger', 'R Ming']",1997.0,1
Patterns and processes of vertebrate evolution,['RL Carroll'],1997.0,1
Phylogenies and the comparative method: a general approach to incorporating phylogenetic information into the analysis of interspecific data,"['EP Martins', 'TF Hansen']",1997.0,1
Prey adaptation as a cause of predator‐prey cycles,"['PA Abrams', 'H Matsuda']",1997.0,1
QUANTITATIVE GENETICS OF OVARIOLE NUMBER IN DROSOPHILA MELANOGASTER. I. SEGREGATING VARIATION AND FITNESS,"['ML Wayne', 'JB Hackett', 'TFC Mackay']",1997.0,1
"Quantitative trait and allozyme divergence in the Greenfinch (Carduelis chloris, Aves: Fringillidae)",['J Merilä'],1997.0,1
Quantitative trait loci for sensory bristles in Drosophila melanogaster,['MC Gurganus'],1997.0,1
Reducing bias in the measurement of selection,"['R Mauricio', 'LE Mojonniner']",1997.0,1
Role of random genetic drift in the evolution of interactive systems,['T Ohta'],1997.0,1
SPONTANEOUS MUTATIONAL GENOTYPE‐ENVIRONMENT INTERACTION FOR FITNESS‐RELATED TRAITS IN DROSOPHILA MELANOGASTER,"['J Fernández', 'C López‐Fanjul']",1997.0,1
Selection on reproductive characters: floral morphology in Asclepias syriaca,"['MT Morgan', 'DJ Schoen']",1997.0,1
Social support: a genetic-epidemiologic analysis,['KS Kendler'],1997.0,1
Stabilizing selection and the comparative analysis of adaptation,['TF Hansen'],1997.0,1
Stress and metabolic regulation in Drosophila,['AG Clark'],1997.0,1
THE RATE AND EFFECTS DISTRIBUTION OF VIABILITY MUTATION IN DROSOPHILA: MINIMUM DISTANCE ESTIMATION,['A García‐Dorado'],1997.0,1
The evolution of metapopulations,"['NH Barton', 'MC Whitlock']",1997.0,1
The lack of mutational variance for fluctuating and directional asymmetry in Drosophila melanogaster,"['JL Monedero', 'D Chavarrias']",1997.0,1
Using genotype-by-environment interaction for crop cultivar development,['MS Kang'],1997.0,1
copyright in this thesis. Neither the,['W Street'],1997.0,1
A comparison of isozyme and quantitative genetic variation in Pinus contorta ssp. latifolia by FST,"['RC Yang', 'FC Yeh', 'AD Yanchuk']",1996.0,1
Adaptive Inertia Caused by Hidden Pleiotropic E ects,"['M Baatz', 'GP Wagner']",1996.0,1
B2. 7.2 NK Fitness Landscapes,['L Altenberg'],1996.0,1
Comparative population structure across loci in conifers,['RG Latta'],1996.0,1
Density‐dependent selection on continuous characters: A quantitative genetic model,['Y Tanaka'],1996.0,1
Development of neutral and nearly neutral theories,"['T Ohta', 'JH Gillespie']",1996.0,1
Developmental buffering and selection,['C Vogl'],1996.0,1
Effects of single P-element insertions on bristle number and viability in Drosophila melanogaster,"['RF Lyman', 'F Lawrence', 'SV Nuzhdin', 'TFC Mackay']",1996.0,1
Effects of the shape of distribution of mutant effect in nearly neutral mutation models,['H Tachida'],1996.0,1
Environment and genetic variability,['M Jeung'],1996.0,1
Evolution and the consequences of species introductions and deletions,['PA Abrams'],1996.0,1
Evolution of amphimixis and recombination under fluctuating selection in one and many traits,"['AS Kondrashov', 'LY Yampolsky']",1996.0,1
Faunal stability during the early Oligocene climatic crash,"['DR Prothero', 'TH Heaton']",1996.0,1
Genes and adaptation: a pocket guide to the theory,['M Kirkpatrick'],1996.0,1
Good genes and direct selection in the evolution of mating preferences,['M Kirkpatrick'],1996.0,1
"Heritability of wing length in nature for the milkweed bug, Oncopeltus fasciatus","['FR Groeters', 'H Dingle']",1996.0,1
How do flowers diverge?,"['P Wilson', 'JD Thomson']",1996.0,1
