title,author,pub_year,venue,abstract
Evolutionary quantitative genetics,['DA Roff'],2012,NA,"The impetus for this book arose out of my previous book, The Evolution of Life Histories (Roff, 1992). In that book I presented a single chapter on quanti tative genetic theory. However, as the book was concerned with the evolution of life histories and traits connected"
Comparison of genetic differentiation at marker loci and quantitative traits,"['J Merilä', 'P Crnokrak']",2001,Journal of Evolutionary Biology,"The comparison of the degree of differentiation in neutral marker loci and genes coding quantitative traits with standardized and equivalent measures of genetic differentiation (FST and QST, respectively) can provide insights into two important but seldom explored"
Phylogenies and quantitative characters,['J Felsenstein'],1988,Annual Review of Ecology and Systematics,"Systematists and evolutionary geneticists don't often talk to each other, and they routinely disparage each other's work as being of little relevance to evolution. Systematists sometimes invoke the punctuationist argument that most evolutionary change does not occur by"
Limits to the adaptive potential of small populations,"['Y Willi', 'J Van Buskirk']",2006,Annu. Rev. Ecol. Evol. Syst.,"Small populations are predicted to have reduced capacity to adapt to environmental change for two reasons. First, population genetic models indicate that genetic variation and potential response to selection should be positively correlated with population size. The empirical"
Evolutionary quantitative genetics: how little do we know?,"['NH Barton', 'M Turelli']",1989,Annual review of genetics,"The centenary of Galton's (84)"" Natural Inheritance"" emphasizes the continu ity between the ideas of the early pioneers and the modem renaissance of evolutionary quantitative genetics (142). Many questions posed by Galton, Weldon, and Pearson remain only partially"
The frailty of adaptive hypotheses for the origins of organismal complexity,['M Lynch'],2007,Proceedings of the National Academy of …,The vast majority of biologists engaged in evolutionary studies interpret virtually every aspect of biodiversity in adaptive terms. This narrow view of evolution has become untenable in light of recent observations from genomic sequencing and population-genetic
The evolutionary genetics of personality,"['L Penke', 'JJA Denissen', 'GF Miller']",2007,European Journal of …,"Genetic influences on personality differences are ubiquitous, but their nature is not well understood. A theoretical framework might help, and can be provided by evolutionary genetics. We assess three evolutionary genetic mechanisms that could explain genetic"
Evolution and extinction in a changing environment: a quantitative‐genetic analysis,"['R Bürger', 'M Lynch']",1995,Evolution,"Because of the ubiquity of genetic variation for quantitative traits, virtually all populations have some capacity to respond evolutionarily to selective challenges. However, natural selection imposes demographic costs on a population, and if these costs are sufficiently"
Translating between microevolutionary process and macroevolutionary patterns: the correlation structure of interspecific data,"['TF Hansen', 'EP Martins']",1996,Evolution,"As species evolve along a phylogenetic tree, we expect closely related species to retain some phenotypic similarities due to their shared evolutionary histories. The amount of expected similarity depends both on the hierarchical phylogenetic structure, and on the"
Quantitative trait loci in Drosophila,['TFC Mackay'],2001,Nature reviews genetics,Phenotypic variation for quantitative traits results from the simultaneous segregation of alleles at multiple quantitative trait loci. Understanding the genetic architecture of quantitative traits begins with mapping quantitative trait loci to broad genomic regions and
Quantitative trait loci in Drosophila,['TFC Mackay'],2001,Nature reviews genetics,Phenotypic variation for quantitative traits results from the simultaneous segregation of alleles at multiple quantitative trait loci. Understanding the genetic architecture of quantitative traits begins with mapping quantitative trait loci to broad genomic regions and
Perspective: spontaneous deleterious mutation,"['M Lynch', 'J Blanchard', 'D Houle', 'T Kibota', 'S Schultz']",1999,…,"Mildly deleterious mutation has been invoked as a leading explanation for a diverse array of observations in evolutionary genetics and molecular evolution and is thought to be a significant risk of extinction for small populations. However, much of the empirical evidence"
A quantitative-genetic perspective on conservation issues,['M Lynch'],1995,Conservation genetics: case histories from nature,CiNii 国立情報学研究所 学術情報ナビゲータ[サイニィ]. メニュー 検索
Evolution of resistance to high temperature in ectotherms,"['RB Huey', 'JG Kingsolver']",1993,The American Naturalist,Body temperature influences the performance and fitness of ectotherms. How thermal sensitivity responds to selection for resistance to high temperature is broadly relevant in evolutionary physiology and also has practical implications. We review several
Resolving the paradox of stasis: models with stabilizing selection explain evolutionary divergence on all timescales,"['S Estes', 'SJ Arnold']",2007,The american naturalist,"We tested the ability of six quantitative genetic models to explain the evolution of phenotypic means using an extensive database compiled by Gingerich. Our approach differs from past efforts in that we use explicit models of evolutionary process, with parameters estimated from"
Population genetics,['MB Hamilton'],2021,NA,"Now updated for its second edition, Population Genetics is the classic, accessible introduction to the concepts of population genetics. Combining traditional conceptual approaches with classical hypotheses and debates, the book equips students to understand"
Methods for the analysis of comparative data in evolutionary biology,['M Lynch'],1991,Evolution,"Inferences regarding phylogenetic patterns and constraints on the evolution of characters often can be derived only from comparisons of extant species. If the phylogeny of these species is known, then the mean phenotypes of taxa can be partitioned into heritable"
Evolution of gene expression in the Drosophila melanogaster subgroup,"['SA Rifkin', 'J Kim', 'KP White']",2003,Nature genetics,"Little is known about broad patterns of variation and evolution of gene expression during any developmental process. Here we investigate variation in genome-wide gene expression among Drosophila simulans, Drosophila yakuba and four strains of Drosophila"
Independently evolving species in asexual bdelloid rotifers,"['D Fontaneto', 'EA Herniou', 'C Boschetti', 'M Caprioli']",2007,PLoS …,"Asexuals are an important test case for theories of why species exist. If asexual clades displayed the same pattern of discrete variation as sexual clades, this would challenge the traditional view that sex is necessary for diversification into species. However, critical"
A neutral model of transcriptome evolution,"['P Khaitovich', 'G Weiss', 'M Lachmann', 'I Hellmann']",2004,PLoS …,"Microarray technologies allow the identification of large numbers of expression differences within and between species. Although environmental and physiological stimuli are clearly responsible for changes in the expression levels of many genes, it is not known whether the"
Comparative studies of gene expression and the evolution of gene regulation,"['IG Romero', 'I Ruvinsky', 'Y Gilad']",2012,Nature Reviews Genetics,"The hypothesis that differences in gene regulation have an important role in speciation and adaptation is more than 40 years old. With the advent of new sequencing technologies, we are able to characterize and study gene expression levels and associated regulatory"
Is self‐fertilization an evolutionary dead end? Revisiting an old hypothesis with genetic theories and a macroevolutionary approach,"['N Takebayashi', 'PL Morrell']",2001,American Journal of Botany,G. Ledyard Stebbins suggested that self‐fertilization (selfing) may be an evolutionary dead end because it may result in the loss of genetic diversity and consequently preclude adaptation to changing environments. While the basic premise of selfing as a dead end is
"Craniometric variation, genetic theory, and modern human origins","['DJH Relethford', 'HC Harpending']",1994,American Journal of Physical …,"Recent controversies surrounding models of modern human origins have focused on among‐group variation, particularly the reconstruction of phylogenetic trees from mitochondrial DNA (mtDNA) and, the dating of population divergence. Problems in tree estimation have been"
Q ST–F ST comparisons: evolutionary and ecological insights from genomic heterogeneity,"['T Leinonen', 'RJS McCairns', ""RB O'hara""]",2013,Nature Reviews …,"Comparative studies of the divergence of quantitative traits and neutral molecular markers, known as Q ST–F ST comparisons, provide a means for researchers to distinguish between natural selection and genetic drift as causes of population differentiation in complex"
Evolution of primate gene expression,"['P Khaitovich', 'W Enard', 'M Lachmann']",2006,Nature Reviews …,"It has been suggested that evolutionary changes in gene expression account for most phenotypic differences between species, in particular between humans and apes. What general rules can be described governing expression evolution? We find that a neutral"
Spontaneous mutation accumulation studies in evolutionary genetics,"['DL Halligan', 'PD Keightley']",2009,Annual Review of Ecology …,"Mutation accumulation (MA) experiments, in which mutations are allowed to drift to fixation in inbred lines, have been a principal way of studying the rates and properties of new spontaneous mutations. Phenotypic assays of MA lines inform us about the nature of new"
Neutral theory of quantitative genetic variance in an island model with local extinction and colonization,['R Lande'],1992,Evolution,"Additive genetic variance maintained by mutation in a selectively neutral quantitative character is analyzed for an ideal population distributed on n islands, each with local effective size N, that exchange migrants at a small rate, m. In a stable population structure"
Rapid evolution of male-biased gene expression in Drosophila,"['CD Meiklejohn', 'J Parsch', 'JM Ranz']",2003,Proceedings of the …,A number of genes associated with sexual traits and reproduction evolve at the sequence level faster than the majority of genes coding for non-sex-related traits. Whole genome analyses allow this observation to be extended beyond the limited set of genes that have
Testing natural selection vs. genetic drift in phenotypic evolution using quantitative trait locus data,['HA Orr'],1998,Genetics,Evolutionary biologists have long sought a way to determine whether a phenotypic difference between two taxa was caused by natural selection or random genetic drift. Here I argue that data from quantitative trait locus (QTL) analyses can be used to test the null
House mice as models in systematic biology,"['RD Sage', 'WR Atchley', 'E Capanna']",1993,Systematic Biology,"We evaluated the house mouse (Mus musculus species complex) and its laboratory descendents as models for three aspects of systematic biology: hybrid zone biology, chromosomal evolution and speciation, and tests for methods of phylogenetic"
The transcriptional consequences of mutation and natural selection in Caenorhabditis elegans,"['DR Denver', 'K Morris', 'JT Streelman', 'SK Kim', 'M Lynch']",2005,Nature …,"The evolutionary importance of gene-expression divergence is unclear: some studies suggest that it is an important mechanism for evolution by natural selection 1, 2, whereas others claim that most between-species regulatory changes are neutral or nearly neutral 3"
The rate of polygenic mutation,['M Lynch'],1988,Genetics Research,"By application of the neutral model of phenotypic evolution, quantitative estimates of the rate of input of genetic variance by polygenic mutation can be extracted from divergence experiments as well as from the response of an inbred base population to selection. The"
"Adaptive landscapes, genetic distance and the evolution of quantitative characters","['NH Barton', 'M Turelli']",1987,Genetics Research,The maintenance of polygenic variability by a balance between mutation and stabilizing selection has been analysed using two approximations: the 'Gaussian'and the 'house of cards'. These lead to qualitatively different relationships between the equilibrium genetic
Genomic mutation rates for lifetime reproductive output and lifespan in Caenorhabditis elegans,"['PD Keightley', 'A Caballero']",1997,Proceedings of the National …,Theory concerning the evolution of sex and recombination and mutation load relies on information on rates and distributions of effects of deleterious mutations. Direct information on the genomic mutation rate in Drosophila implies that an accumulation of mildly
Quantitative genetics in plants: the effect of the breeding system on genetic variability,"['D Charlesworth', 'B Charlesworth']",1995,Evolution,"The expected effects of breeding system on quantitative genetic variation under various models for the maintenance of such variation are examined, with particular emphasis on the contrast between randomly mating and highly self‐fertilizing populations. Estimates of"
Population genetic variation in gene expression is associated with phenotypic variation in Saccharomyces cerevisiae,"['JC Fay', 'HL McCullough']",2004,Genome …,The relationship between genetic variation in gene expression and phenotypic variation observable in nature is not well understood. Identifying how many phenotypes are associated with differences in gene expression and how many gene-expression differences
Natural selection on gene expression,"['Y Gilad', 'A Oshlack', 'SA Rifkin']",2006,TRENDS in Genetics,"Changes in genetic regulation contribute to adaptations in natural populations and influence susceptibility to human diseases. Despite their potential phenotypic importance, the selective pressures acting on regulatory processes in general and gene expression levels in"
Causes of covariation of phenotypic traits among populations,"['WS Armbruster', 'KE Schwaegerle']",1996,Journal of Evolutionary …,"Morphological and life‐history traits often vary among populations of a species. Traits generally do not vary independently, but show patterns of covariation that can arise from genetic and environmental influences on phenotype. Covariance of traits may arise at an"
Comparative animal biochemistry,['K Urich'],2013,NA,"tribute greatly to understanding the origins of The plan for this book goes back almost 20 years. Already, at that time, it was possible to recognize organisms. an extraordinary variation in metabolites and To provide the biochemist with a ready over processes"
"Evolvability, stabilizing selection, and the problem of stasis","['TF Hansen', 'D Houle']",2004,… : Studying the ecology and evolution of …,Evolutionary stasis has a paradoxical position in current evolutionary thinking. Williams (1992) argued convincingly that stasis is one of the most important unsolved problems of evolutionary biology (see also Bradshaw 1991). Stasis is arguably the predominant mode of
Rapid evolution of expression and regulatory divergences after yeast gene duplication,"['X Gu', 'Z Zhang', 'W Huang']",2005,Proceedings of the National …,"Although gene duplication is widely believed to be the major source of genetic novelty, how the expression or regulatory network of duplicate genes evolves remains poorly understood. In this article, we propose an additive expression distance between duplicate genes, so that"
A mutation accumulation assay reveals a broad capacity for rapid evolution of gene expression,"['SA Rifkin', 'D Houle', 'J Kim', 'KP White']",2005,Nature,Mutation is the ultimate source of biological diversity because it generates the variation that fuels evolution 1. Gene expression is the first step by which an organism translates genetic information into developmental change. Here we estimate the rate at which mutation
Were neandertal and modern human cranial differences produced by natural selection or genetic drift?,"['TD Weaver', 'CC Roseman', 'CB Stringer']",2007,Journal of human evolution,Most evolutionary explanations for cranial differences between Neandertals and modern humans emphasize adaptation by natural selection. Features of the crania of Neandertals could be adaptations to the glacial climate of Pleistocene Europe or to the high mechanical
Which cranial regions reflect molecular distances reliably in humans? Evidence from three‐dimensional morphology,['HF Smith'],2009,American Journal of Human Biology: The Official …,Knowledge of the degree to which various subsets of morphological data reflect molecular relationships is crucial for studies attempting to estimate genetic relationships from patterns of morphological variation. This study assessed the phylogenetic utility of six
Neutral additive genetic variance in a metapopulation,['MC Whitlock'],1999,Genetics Research,"For neutral, additive quantitative characters, the amount of additive genetic variance within and among populations is predictable from Wright's FST, the effective population size and the mutational variance. The structure of quantitative genetic variance in a subdivided"
Contrasting patterns of divergence in quantitative traits and neutral DNA markers: analysis of clinal variation,['JF Storz'],2002,Molecular Ecology,"Clinal variation in quantitative traits is often attributed to the effects of spatially varying selection. However, identical patterns can be produced by the interplay between purely stochastic processes (ie drift in combination with spatially restricted gene flow). One means"
Modeling genetic architecture: a multilinear theory of gene interaction,"['TF Hansen', 'GP Wagner']",2001,Theoretical population biology,The map from genotype to phenotype is an exceedingly complex function of central importance in biology. In this work we derive and analyze a mathematically tractable model of the genotype–phenotype map that allows for any order of gene interaction. By assuming
Microevolution in island forms: the roles of drift and directional selection in morphological divergence of a passerine bird,"['SM Clegg', 'SM Degnan', 'C Moritz', 'A Estoup']",2002,…,Theory predicts that in small isolated populations random genetic drift can lead to phenotypic divergence; however this prediction has rarely been tested quantitatively in natural populations. Here we utilize natural repeated island colonization events by members
The evolution of the G matrix: selection or drift?,['D Roff'],2000,Heredity,"The evolution of quantitative characters can be described by the equation Δz¯= GP− 1S where Δz¯ is the vector of mean responses, G is the matrix of additive genetic variances and covariances, P is the matrix of phenotypic variances and covariances and S is the vector of"
"Rates of divergence in gene expression profiles of primates, mice, and flies: stabilizing selection and variability among functional categories","['B Lemos', 'CD Meiklejohn', 'M Cáceres', 'DL Hartl']",2005,Evolution,The extent to which natural selection shapes phenotypic variation has long been a matter of debate among those studying organic evolution. We studied the patterns of gene expression polymorphism and divergence in several datasets that ranged from comparisons between
Estimates of the Rate and Distribution of Fitness Effects of Spontaneous Mutation in Saccharomyces cerevisiae,"['C Zeyl', 'JAGM DeVisser']",2001,Genetics,"The per-genome, per-generation rate of spontaneous mutation affecting fitness (U) and the mean fitness cost per mutation (s) are important parameters in evolutionary genetics, but have been estimated for few species. We estimated U and sh (the heterozygous effect of"
Naturally occurring variation in bristle number and DNA polymorphisms at the scabrous locus of Drosophila melanogaster,"['C Lai', 'RF Lyman', 'AD Long', 'CH Langley']",1994,Science,"The association between quantitative genetic variation in bristle number and molecular variation at a candidate neurogenic locus, scabrous, was examined in Drosophila melanogaster. Approximately 32 percent of the genetic variation in abdominal bristle"
Song divergence by sensory drive in Amazonian birds,"['JA Tobias', 'J Aben', 'RT Brumfield']",2010,… Journal of Organic …,"Visual signals are shaped by variation in the signaling environment through a process termed sensory drive, sometimes leading to speciation. However, the evidence for sensory drive in acoustic signals is restricted to comparisons between highly dissimilar habitats, or"
Spontaneous Mutational Effects on Reproductive Traits of Arabidopsis thaliana,"['RG Shaw', 'DL Byers', 'E Darmo']",2000,Genetics,"A study of spontaneous mutation in Arabidopsis thaliana was initiated from a single inbred Columbia founder; 120 lines were established and advanced 17 generations by single-seed descent. Here, we report an assay of reproductive traits in a random set of 40 lines from"
Evolution of genetic variability and the advantage of sex and recombination in changing environments,['R Bürger'],1999,Genetics,"The role of recombination and sexual reproduction in enhancing adaptation and population persistence in temporally varying environments is investigated on the basis of a quantitative-genetic multilocus model. Populations are finite, subject to density-dependent regulation"
Inbreeding Changes the Shape of the Genetic Covariance Matrix in Drosophila melanogaster,"['PC Phillips', 'MC Whitlock', 'K Fowler']",2001,Genetics,The pattern of genetic covariation among traits (the G matrix) plays a central role in determining the pattern of evolutionary change from both natural selection and random genetic drift. Here we measure the effect of genetic drift on the shape of the G matrix using a
Evaluating the role of natural selection in the evolution of gene regulation,"['JC Fay', 'PJ Wittkopp']",2008,Heredity,"Surveys of gene expression reveal extensive variability both within and between a wide range of species. Compelling cases have been made for adaptive changes in gene regulation, but the proportion of expression divergence attributable to natural selection"
Genetic isolation of fragmented populations is exacerbated by drift and selection,"['Y Willi', 'J Van Buskirk', 'B Schmid']",2007,Journal of evolutionary …,"Reduced genetic variation at marker loci in small populations has been well documented, whereas the relationship between quantitative genetic variation and population size has attracted little empirical investigation. Here we demonstrate that both neutral and"
"The population genetics of mutations: good, bad and indifferent","['L Loewe', 'WG Hill']",2010,NA,"Population genetics is fundamental to our understanding of evolution, and mutations are essential raw materials for evolution. In this introduction to more detailed papers that follow, we aim to provide an oversight of the field. We review current knowledge on mutation rates"
Uncovering evolutionary patterns of gene expression using microarrays,"['JM Ranz', 'CA Machado']",2006,Trends in Ecology & Evolution,"The advent of microarray technology is providing new insights into fundamental questions in evolutionary biology. Here, we review the recent literature on the use of microarrays to study the evolution of genome-wide patterns of gene expression within and between species"
Rate tests for selection on quantitative characters during macroevolution and microevolution,"['M Turelli', 'JH Gillespie', 'R Lande']",1988,Evolution,"Evolutionary biologists are increasingly interested in testing alternative models rather than simply presenting plausible explanations for their observations. Although most biologists agree that significant phenotypic changes cannot occur without natural selection, it is useful"
Mixed-model reanalysis of primate data suggests tissue and species biases in oligonucleotide-based gene expression profiles,"['WP Hsieh', 'TM Chu', 'RD Wolfinger', 'G Gibson']",2003,Genetics,"An emerging issue in evolutionary genetics is whether it is possible to use gene expression profiling to identify genes that are associated with morphological, physiological, or behavioral divergence between species and whether these genes have undergone positive"
Bayesian species delimitation combining multiple genes and traits in a unified framework,"['C Solís‐Lemus', 'LL Knowles', 'C Ané']",2015,Evolution,"Delimitation of species based exclusively on genetic data has been advocated despite a critical knowledge gap: how might such approaches fail because they rely on genetic data alone, and would their accuracy be improved by using multiple data types. We provide here"
How much heritable variation can be maintained in finite populations by mutation–selection balance?,"['R Bürger', 'GP Wagner', 'F Stettinger']",1989,Evolution,"The joint effects of stabilizing selection, mutation, recombination, and random drift on the genetic variability of a polygenic character in a finite population are investigated. A simulation study is performed to test the validity of various analytical predictions on the"
Age-specific properties of spontaneous mutations affecting mortality in Drosophila melanogaster,"['SD Pletcher', 'D Houle', 'JW Curtsinger']",1998,Genetics,An analysis of the effects of spontaneous mutations affecting age-specific mortality was conducted using 29 lines of Drosophila melanogaster that had accumulated spontaneous mutations for 19 generations. Divergence among the lines was used to estimate the
