title,author,pub_year,venue,abstract
Increase in Quantitative Variation After Exposure to Environmental Stresses and/or Introduction of a Major Mutation: G × E Interaction and Epistasis or Canalization?,['XS Zhang'],2008,Genetics,Why does phenotypic variation increase upon exposure of the population to environmental stresses or introduction of a major mutation? It has usually been interpreted as evidence of canalization (or robustness) of the wild-type genotype; but an alternative population genetic
Spontaneous mutation for life-history traits in Drosophila melanogaster,"['C Martorell', 'MA Toro', 'C Gallego']",1998,Mutation and Evolution,"Spontaneous mutations accumulated during 80 generations in 94 lines derived from a completely homozygous population of Drosophila melanogaster, all of them maintained by a single brother-sister mating per generation. Three traits were evaluated: early productivity"
Spontaneous Mutations Decrease Sensitivity of Gene Expression to Random Environmental Variation in Caenorhabditis elegans,"['CF Baer', 'DR Denver']",2010,PloS one,"Background Biological phenotypes are described as “canalized” if they are robust to minor variation of environment and/or genetic background. The existence of a robust phenotype logically implies that some underlying mechanism must be variable, in the sense of “able to"
The stochastic model of non-equilibrium mutagen-induced alterations of DNA: Implication to genetic instability in cancer,"['D Triampo', 'W Triampo', 'IM Tang', 'Y Lenbury']",2007,Biosystems,"Genetic alterations such as point mutations, chromosomal rearrangements, modification of DNA methylation and chromosome aberrations accumulate during the lifetime of an organism. They can be caused by intrinsic errors in the DNA replication and repair as well"
Using geometric morphometric visualizations of directional selection gradients to investigate morphological differentiation,"['TD Weaver', 'P Gunz']",2018,Evolution,"Researchers studying extant and extinct taxa are often interested in identifying the evolutionary processes that have lead to the morphological differences among the taxa. Ideally, one could distinguish the influences of neutral evolutionary processes (genetic drift"
Evolution as a largely autonomous process,['F Bokma'],2015,Macroevolution,"Evolutionary theory has proven generally successful in predicting phenotypic changes over one or a few generations of natural or artificial selection, but fails to predict evolutionary dynamics over longer periods of time, which is a major shortcoming: At longer timescales"
Genetic factors associated with variation in abundance of the invasive yellow crazy ant (Anoplolepis gracilipes),['MAM Gruber'],2012,NA,"A key component of successful invasion is the ability of an introduced population to reach sufficient abundance to persist, spread, and alter or dominate the recipient biological community. Genetic diversity is one of many factors that may contribute to population"
Quantitative Genetics of Life History Microevolution in the Cayo Santiago Rhesus Macaques (Macaca Mulatta).,['GE Blomquist'],2007,NA,"This is a study of the evolutionary genetics of a large colony of free-ranging rhesus macaques on Cayo Santiago, a small island located just off the coast of Puerto Rico. It focuses on documenting genetic and environmental influences on life history variation in"
"Concordance between stabilizing sexual selection, intraspecific variation, and interspecific divergence in Phymata","['D Punzalan', 'L Rowe']",2016,Ecology and evolution,Empirical studies show that lineages typically exhibit long periods of evolutionary stasis and that relative levels of within‐species trait covariance often correlate with the extent of between‐species trait divergence. These observations have been interpreted by some as
The population dynamics of a hybrid zone in the alpine grasshopper Podisma pedestris: An ecological and genetic investigation,['KS Jackson'],1992,NA,This thesis describes ecological and genetic investigations of a hybrid zone between incompatible genotypes in the alpine grasshopper Podisma pedestris. The two races are distinguished by a Robertsonian fusion between the X chromosome and an autosome. The
Evolutionary models of quantitative disease risk factors,"['A Connor', 'KM Weiss', 'SC Weeks']",1993,Human biology,Numerous mutations are now known that have significant effects on various phenotypes; many of these mutations are of interest because they influence quantitative risk factors for major diseases. Such diversity raises the question of how much genetic heterogeneity we
"Multivariate morphometrics, quantitative genetics, and neutral theory: Developing a “modern synthesis” for primate evolutionary morphology",['N von Cramon‐Taubadel'],2019,Evolutionary Anthropology: Issues …,Anthropologists are increasingly turning to explicit model‐bound evolutionary approaches for understanding the morphological diversification of humans and other primate lineages. Such evolutionary morphological analyses rely on three interconnected conceptual
The red death meets the abdominal bristle: Polygenic mutation for susceptibility to a bacterial pathogen in Caenorhabditis elegans,"['V Etienne', 'EC Andersen', 'JM Ponciano', 'D Blanton']",2015,…,"Understanding the genetic basis of susceptibility to pathogens is an important goal of medicine and of evolutionary biology. A key first step toward understanding the genetics and evolution of any phenotypic trait is characterizing the role of mutation. However, the rate at"
Selection and drift determine phenotypic stasis despite genetic divergence,"['F Mallard', 'L Noble', 'T Guzella', 'B Afonso', 'CF Baer']",2019,bioRxiv,"Evolutionary theory suggests that phenotypic stasis is explained by natural selection and genetic drift, or by constraints imposed by mutation and recombination of standing genetic variation. We performed experimental evolution from standing genetic variation with the"
Phenotypic lag and population extinction in the moving-optimum model: insights from a small-jumps limit,"['M Kopp', 'E Nassar', 'E Pardoux']",2018,Journal of mathematical biology,"Continuous environmental change—such as slowly rising temperatures—may create permanent maladaptation of natural populations: Even if a population adapts evolutionarily, its mean phenotype will usually lag behind the phenotype favored in the current"
Transcriptome evolution–much ado about nothing?,['F Rodrıguez-Trelles'],2004,Heredity,"Long-standing questions in evolu-tionary biology are being tackled with help from microarray technologies analyzing the transcriptome, namely the whole set of transcripts and their relative levels of expression in a cell or tissue type under defined conditions. In a"
Rates of cranial evolution in Neandertals and modern humans,['TD Weaver'],2011,Computational paleontology,"Rates of phenotypic evolution have been a persistent interest of paleontologists (eg, Eldredge and Gould 1972; Gingerich 1983; Hunt 2007; Stanley 1985), because of their potential to illuminate the mechanisms that generate or constrain phenotypic diversification"
Relative effects of segregation and recombination on the evolution of sex in finite diploid populations,"['X Jiang', 'S Hu', 'Q Xu', 'Y Chang', 'S Tao']",2013,Heredity,"The mechanism of reproducing more viable offspring in response to selection is a major factor influencing the advantages of sex. In diploids, sexual reproduction combines genotype by recombination and segregation. Theoretical studies of sexual reproduction"
Decoupling the variances of heterosis and inbreeding effects is evidenced in yeast's life-history and proteomic traits,"['M Petrizzelli', 'D de Vienne', 'C Dillmann']",2019,Genetics,"Heterosis (hybrid vigor) and inbreeding depression, commonly considered as corollary phenomena, could nevertheless be decoupled under certain assumptions according to theoretical population genetics works. To explore this issue on real data, we analyzed the"
A neutrality test for continuous characters based on levels of intraspecific variation and interspecific divergence,['AG Clark'],1994,Non-Neutral Evolution,One of the most powerful approaches for inferring the action of evolutionary forces is the comparison of intraspecific nucleotide polymorphism to the divergence between species in DNA sequences. The infinite sites model of neutral molecular evolution provides a well
A genetic model of interpopulation variation and covariation of quantitative characters,['ZB Zeng'],1989,Genetics Research,"Evolutionary consequences of natural selection, migration, genotype–environment interaction, and random genetic drift on interpopulation variation and covariation of quantitative characters are analysed in terms of a selection model that partitions natural"
"Mutation, eugenics, and the boundaries of science",['M Lynch'],2016,Genetics,"In my recent Perspectives article, I reviewed what we know about human mutation rates and their effects, and I highlighted the potential long-term consequences of established goals in human medicine (Lynch 2016). Given the complexity of the personal and societal issues"
Further observations on the evolution of additive genetic variation with mutation,['CC Cockerham'],1994,Theoretical population biology,"Two mutation models, LH by Lynch and Hill and CT by Cockerham and Tachida, utilized for a neutral quantitative character caused by genes with additive effects undergoing mutation and drift, were compared for the genetic variances within, σ w 2, and between, σ b 2"
Stationary frequencies and mixing times for neutral drift processes with spatial structure,"['A McAvoy', 'B Adlam', 'B Allen']",2018,Proceedings of the …,"We study a general setting of neutral evolution in which the population is of finite, constant size and can have spatial structure. Mutation leads to different genetic types (traits), which can be discrete or continuous. Under minimal assumptions, we show that the marginal trait"
Genetic studies of population history and contemporary microevolution in grayling (Thymallus: Salmonidae),['MT Koskinen'],2002,NA,One of the principal aims of population genetics is to quantify the amount of inheritable variation present in nature. Population genetics thereby attempts to shed light on the fundamental question in evolutionary biology: what determines genetic differences between
A mandible arresting system in neotropical social wasps (Vespidae; Polistinae): structural diversity within homogeneous functionality,"['S López-Cubillos', 'CE Sarmiento']",2013,Naturwissenschaften,"Microtrichia are epidermal protuberances that may serve as temporary adhesive devices. Several insects possess these structures; however, they have not previously been reported in social wasps. With scanning electron microscopy, we characterize the shape and"
Pattern and evolution of pleiotropic effects: analysis of QTL data and an epistatic model,['JG Mezey'],2000,NA,"Pleiotropic effects are of interest for modeling change in phenotypic traits. In this thesis, empirical and theoretical approaches are utilized to analyze the distribution of pleiotropic effects that may occur as a result of mutation and to study how pleiotropic effects may"
Fly wing evolution explained by a neutral model with mutational pleiotropy,"['D Jiang', 'J Zhang']",2020,Evolution,"To what extent the speed of mutational production of phenotypic variation determines the rate of long‐term phenotypic evolution is a central question. Houle et al. recently addressed this question by studying the mutational variances, additive genetic variances, and"
Ontogenetic allometry conservatism across five teleost orders,['KM da Silva Alcantara Castro'],2018,Journal of fish …,"Geometric morphometrics were used to analyse ontogenetic trajectories in representatives of the Characiformes, Cichliformes, Cyprinodontiformes, Siluriformes, and Tetraodontiformes. It was not possible to differentiate any allometric growth patterns across"
Evolution of neutral quantitative characters with gene interaction and mutation,"['H Tachida', 'CC Cockerham']",NA,NA,
The genetic architecture of quantitative traits in locally adapted plant ecotypes,['ER Milano'],2015,NA,"Locally adapted ecotypes are a common phenomenon generating plant diversity within species, yet we know surprisingly little about the genetic mechanisms that lead to locally adapted traits. The genetic architecture underlying traits can indicate evolutionary history"
Variance component analysis of bristle characters in local populations of Drosophila melanogaster,"['M Ichinose', 'H Tachida', 'T Mukai']",1992,The Japanese Journal of Genetics,抄録 The genetic variabilities of sternopleural and abdominal bristle numbers existing in local natural populations were assessed. Using second chromosome lines of Drosophila melanogaster extracted from three natural populations in Japan (the Ishigakijima
Population biology and its application to practical problems,"['LW Botsford', 'SK Jain']",1992,Applied population biology,"The principles of population biology have been successfully applied to a wide variety of practical problems. However, there is a widely held view that the practical application of the principles of population biology has often not lived up to its perceived potential. Possible"
Estimators for QST and coalescence times,['TD Weaver'],2016,Ecology and evolution,"Comparisons of to can provide insights into the evolutionary processes that lead to differentiation, or lack thereof, among the phenotypes of different groups (eg, populations, species), and these comparisons have been performed on a variety of taxa, including"
The effects of demography and genetics on the neutral distribution of quantitative traits,['EM Koch'],2019,Genetics,Neutral models for quantitative trait evolution are useful for identifying phenotypes under selection. These models often assume normally distributed phenotypes. This assumption may be violated when a trait is affected by relatively few variants or when the effects of those
Pervasive adaptation of gene expression in Drosophila,"['A Nourmohammad', 'J Rambeau', 'T Held', 'J Berg']",2015,arXiv preprint arXiv …,"Gene expression levels are important molecular quantitative traits that link genotypes to molecular functions and fitness. In Drosophila, population-genetic studies in recent years have revealed substantial adaptive evolution at the genomic level. However, the"
Neutral theory and the evolution of human physical form: An introduction to models and applications,['T Weaver'],2018,J. Anthropol. Sci,"Anthropologists have long been interested in explaining patterns of variation in human physical form, in both present-day and ancient humans. Starting in the 1950s, their explanations became more firmly rooted in evolutionary theory, but they have typically"
Population perspectives on functional genomic variation in yeast,"['DA Skelly', 'PM Magwene']",2016,Briefings in functional genomics,"Advances in high-throughput sequencing have facilitated large-scale surveys of genomic variation in the budding yeast, Saccharomyces cerevisiae. These surveys have revealed extensive sequence variation between yeast strains. However, much less is known about"
The impact of genomic and traditional selection on the contribution of mutational variance to long-term selection response and genetic variance,"['HA Mulder', 'SH Lee', 'S Clark', 'BJ Hayes']",2019,Genetics,De novo mutations (DNM) create new genetic variance and are an important driver for long-term selection response. We hypothesized that genomic selection exploits mutational variance less than traditional selection methods such as mass selection or selection on
"Contrasting genetic, acoustic, and morphological differentiation in two closely related gladiator frogs (Hylidae: Boana) across a common Neotropical …","['FA Juncá', 'AA Giaretta', 'AJ Crawford', 'E LA MARCA']",2019,Zootaxa,"Mountain chains and rivers are often found to represent barriers promoting vicariant differentiation in terrestrial vertebrates. Previous studies have supported the idea that the Cordillera de Mérida (CM), the easternmost branch of the Northern Andes, represents a"
Descrição da diversidade genética de populações naturais de barbatimão Stryphnodendron adstringens (Mart.) Coville em unidades de conservação de …,"['JS Glasenapp', 'VWD Casali', 'ER Martins', 'CD Cruz']",2014,Revista Árvore,"O objetivo deste estudo foi descrever a diversidade genética de S. adstringens em três populações localizadas em Unidades de Conservação do Estado de Minas Gerais, utilizando-se marcadores isoenzimáticos. Foram amostradas as populações dos Parques"
Biodiversidad morfológico-reproductiva y genética del género endémico canario Parolinia Webb (Brassicaceae),['O Fernández-Palacios Acosta'],2009,NA,"La investigación de esta Memoria Doctoral viene justificada en base a un doble objetivo: i) Obtener la mayor información o conocimiento de la biodiversidad del género endémico Parolinia y del estado actual de las poblaciones naturales de sus especies, tanto desde la"
種分化ダイナミクスと数理モデル-生殖隔離進化の促進要因を探る,['山口諒'],2019,日本生態学会誌,"抄録 生物多様性の創出要因である種分化は, 基本的に長い時間を要する事象であるため時系列に沿った直接観測は難しい. そのため 20 世紀前半より, 数理モデルを用いた理論的研究が種分化に関わる仮説の検証や新仮説の提唱に大きく関わってきた. しかし, 種分化の促進要因は多岐"
Description of genetic diversity of natural populations of barbatimão stryphnodendron adstringens (mart.) coville in conservation areas from Minas Gerais,"['JS Glasenapp', 'VWD Casali', 'ER Martins', 'CD Cruz']",2014,Revista Árvore,"O objetivo deste estudo foi descrever a diversidade genética de S. adstringens em três populações localizadas em Unidades de Conservação do Estado de Minas Gerais, utilizando-se marcadores isoenzimáticos. Foram amostradas as populações dos Parques"
"Patrones ecológicos en poblaciones periféricas de un ave de ecosistemas subdesérticos, el camachuelo trompetero"" bucanetes githagineus""",['R Barrientos Yuste'],2009,NA,"Esta tesis se enmarca en el campo de la Biogeografía y su objetivo general es el estudio de patrones ecológicos en distintos tipos de poblaciones periféricas, usando como modelo un ave de ecosistemas subdesérticos, el camachuelo trompetero Bucanetes githagineus. Se"
Did population differences in human pelvic form evolve by drift or selection?,"['P Mitteroecker', 'NDS Grunstra']",2021,… et mémoires de la …,"Pelvic dimensions differ, on average, among modern human populations. Some recent studies have reported that population differences in pelvic form evolved mainly by neutral processes, without considerable natural selection. This is a surprising claim given the many"
"Sensitivity of quantitative traits to mutational effects, number of loci, and population history","['JG Schraiber', 'MJ Landis']",2014,bioRxiv,"When models of quantitative genetic variation are built from population genetic first principles, several assumptions are often made. One of the most important assumptions is that traits are controlled by many genes of small effect. This leads to a prediction of a"
Evolutionary genetic models of mental disorders,['H Park'],2019,Korean Journal of Biological Psychiatry,"Psychiatric disorder as dysfunctional behavioural syndrome is a paradoxical phenomenon that is difficult to explain evolutionarily because moderate prevalence rate, high heritability and relatively low fitness are shown. Several evolutionary genetic models have been"
Reconstructing cranial evolution in an extinct hominin,['KL Baab'],2021,Proceedings of the Royal Society B,Homo erectus is the first hominin species with a truly cosmopolitan distribution and resembles recent humans in its broad spatial distribution. The microevolutionary events associated with dispersal and local adaptation may have produced similar population
"Mutability of mononucleotide repeats, not oxidative stress, explains the discrepancy between laboratory-accumulated mutations and the natural allele-frequency …","['M Rajaei', 'AS Saxena', 'LM Johnson', 'MC Snyder']",2021,bioRxiv,"Important clues about natural selection can be gleaned from discrepancies between the properties of segregating genetic variants and of mutations accumulated experimentally under minimal selection, provided the mutational process is the same in the lab as in nature"
"Tempo, mode, and fitness effects of mutation in Caenorhabditis elegans over 400 generations of minimal selection","['AS Saxena', 'MP Salomon', 'C Matsuba', 'SD Yeh']",2018,bioRxiv,"The mutational process varies at many levels, from within genomes to among taxa. Many mechanisms have been linked to variation in mutation, but understanding of the evolution of the mutational process is rudimentary. Physiological condition is often implicated as a"
A new phylogenetic tree model for fuzzy characters,['A Auyeung'],2005,… Technology: Coding and Computing (ITCC'05) …,"Perfect phylogeny is one of the most popular character-based models. This model assumes the states of the characters are discrete. Although it provides a simple abstraction of characters, valuable information could be lost during the discretization of the experimental"
Estimate of divergence times for modern human populations based on craniometric variation,['T Hanihara'],2010,Trends in Physical Anthropology,CiNii 国立情報学研究所 学術情報ナビゲータ[サイニィ]. メニュー 検索
"Self-fertilization, genetic associations, and genetic architecture: understanding the components of mating-system evolution",['N Takebayashi'],2000,NA,"This thesis examines components of mating-system evolution at several different levels. At a high taxonomic level, I examined current phylogenetic data to determine if self-fertilization is an evolutionary dead-end. Although we lack large-scale phylogenetic data to quantitatively"
Surface layer proteins as virulence factors in Clostridiun difficile infection,['M Lynch'],2014,NA,"Clostridium difficile is a nosocomial pathogen possessing Surface Layer Proteins (SLPs), which exhibit adherent and immunostimulatory properties. Using bioinformatics tools, evidence of positive selection (PS) was detected in the SLPs of hypervirulent ribotype (RT)"
Quantitative genetic variation induced by P transposable elements in Drosophila melanogaster,['C Lai'],1990,NA,"To determine the ability of the PM hybrid dysgenesis system of Drosophila melanogaster to generate mutations affecting quantitative traits, X chromosome lines were constructed in which replicates of isogenic M and P strain X chromosomes were exposed to a dysgcnic"
Genetic drift does not sufficiently explain patterns of electric signal variation among populations of the mormyrid electric fish Paramormyrops kingsleyae,"['S Picq', 'J Sperling', 'CJ Cheng', 'BA Carlson', 'JR Gallant']",2019,bioRxiv,"The mormyrid fish species Paramormyrops kingsleyae emits an electric organ discharge (EOD) with a dual role in communication and electrolocation. Populations of P. kingsleyae have either biphasic or triphasic EODs, a feature which characterizes interspecific signal"
Distinguishing closely related modern human populations using cranial morphometrics: a view from Korea and Japan,['K Harrington'],2020,NA,One of the continuing issues in biological anthropology research on human variation is whether two closely related populations can be distinguished using skeletal methods. This dissertation uses morphological approaches to analyze 2D and 3D cranial data from Korean
Population genetics,"['K Wöhrmann', 'V Loeschcke']",1987,Progress in botany,During the last years rapid development has occurred in two fields of population genetics. New techniques in molecular biology made data available in prokaryotes and eukaryotes which could be analyzed at the population level. After about 20 years of enzyme variability
Etude des bases (épi) génétiques de l'adaptation dans une expérience de sélection divergente pour la précocité de floraison chez le maïs,['E Durand'],2011,NA,"Résumé La variation quantitative résulte de l'action combinée des gènes et de leur environnement. Pour comprendre la relation génotype-phénotype et disséquer l'architecture des caractères complexes, deux approches sont couramment employées. D'une part"
Article (Discoveries),"['AS Saxena', 'MP Salomon', 'C Matsuba', 'SD Yeh']",2018,NA,"The mutational process varies at many levels, from within genomes to among taxa. Many mechanisms have been linked to variation in mutation, but understanding of the evolution of the mutational process is rudimentary. Physiological condition is often implicated as a"
Assortative mating can help adaptation of flowering time to a changing climate: Insights from a polygenic model,"['C Godineau', 'O Ronce', 'C Devaux']",2021,Journal of Evolutionary …,"Several empirical studies report fast evolutionary changes in flowering time in response to contemporary climate change. Flowering time is a polygenic trait under assortative mating, since flowering time of mates must overlap. Here, we test whether assortative mating"
Decoupling of heterosis and inbreeding variances is evidenced in yeast's life-history and proteomic traits,"['M Petrizzelli', 'D de Vienne', 'C Dillmann']",2018,bioRxiv,"Heterosis (hybrid vigor) and inbreeding depression, commonly considered as corollary phenomena, could nevertheless be decoupled under certain assumptions according to theoretical population genetics works. In order to explore this issue on real data, we"
