title,author,pub_year,venue,abstract
Close correspondence between quantitative-and molecular-genetic divergence times for Neandertals and modern humans,"['TD Weaver', 'CC Roseman']",2008,Proceedings of the …,"Recent research has shown that genetic drift may have produced many cranial differences between Neandertals and modern humans. If this is the case, then it should be possible to estimate population genetic parameters from Neandertal and modern human cranial"
Model adequacy and the macroevolution of angiosperm functional traits,"['MW Pennell', 'RG FitzJohn', 'WK Cornwell']",2015,The American …,Making meaningful inferences from phylogenetic comparative data requires a meaningful model of trait evolution. It is thus important to determine whether the model is appropriate for the data and the question being addressed. One way to assess this is to ask whether the
Evolution of the genomic rate of recombination in mammals,"['BL Dumont', 'BA Payseur']",2008,Evolution: International Journal of …,"Rates of recombination vary considerably between species. Despite the significance of this observation for evolutionary biology and genetics, the evolutionary mechanisms that contribute to these interspecific differences are unclear. On fine physical scales"
Toward a neutral evolutionary model of gene expression,"['P Khaitovich', 'S Pääbo', 'G Weiss']",2005,Genetics,We introduce a stochastic model that describes neutral changes of gene expression over evolutionary time as a compound Poisson process where evolutionary events cause changes of expression level according to a given probability distribution. The model
The evolution of bird coloration and plumage elaboration,['UM Savalli'],1995,Current ornithology,"Although physically homogeneous, birds come in a wide variety of colors, rivaling butterflies and tropical reef fishes. Such variation invites attention and many hypotheses have been developed to explain the evolution of avian color and pattern. In addition, plumage of birds"
"Composite traits, selection response, and evolution",['B Riska'],1989,Evolution,It is very difficult to relate macroevolutionary patterns to the microevolutionary processes described by quantitative‐genetic models. Quantitative‐genetic parameters are statistical abstractions. Their long‐term significance and evolution might be understood if they can be
THE CONTRIBUTION OF NEW MUTATIONS TO GENOTYPE‐ENVIRONMENT INTERACTION FOR FITNESS IN DROSOPHILA MELANOGASTER,"['JD Fry', 'SL Heinsohn', 'TFC Mackay']",1996,Evolution,"Many studies have documented the existence of genotype‐environment interaction (GEI) for traits closely related to fitness in natural populations. A type of GEI that is commonly observed is changes in the fitness ranking of genetic groups (families, clones, or inbred"
"Evolutionary insights into global patterns of human cranial diversity: population history, climatic and dietary effects",['N von Cramon-Taubadel'],2014,J. Anthropol. Sci,"The study of cranial variation has a long, and somewhat difficult, history within anthropology. Much of this difficulty is rooted in the historical use of craniometric data to justify essentialist typological racial classification schemes. In the post-war era of the 'New Physical"
Mathematical properties of mutation-selection models,['R Bürger'],1998,Genetica,"This article provides an overview of the mathematical properties of various deterministic mutation-selection models. Many, even basic, results about models with more than two alleles per locus have only been obtained in the past two decades and are scattered"
"Mutation, selection, and the maintenance of life‐history variation in a natural population","['M Lynch', 'L Latta', 'J Hicks', 'M Giorgianni']",1998,Evolution,"In an effort to provide insight into the role of mutation in the maintenance of genetic variance for life‐history traits, we accumulated spontaneous mutations in 10 sets of clonal replicates of Daphnia pulex for approximately 30 generations and compared the variance generated"
Molecules versus morphology? Not for the human cranium,"['CC Roseman', 'TD Weaver']",2007,Bioessays,"Evolutionary investigations of human crania typically take a limited view of cranial diversity as they discount the possibility that human cranial variation could simply be due to the effects of random genetic drift, gene flow and mutation in favor of natural selection and"
"Detection of “punctuated equilibrium” by Bayesian estimation of speciation and extinction rates, ancestral character states, and rates of anagenetic and cladogenetic …",['F Bokma'],2008,Evolution: International Journal of Organic Evolution,"Algorithms are presented to simultaneously estimate probabilities of speciation and extinction, rates of anagenetic and cladogenetic phenotypic evolution, as well as ancestral character states, from a complete ultrametric species‐level phylogeny with dates assigned to"
Lack of concordance between genetic diversity estimates at the molecular and quantitative-trait levels,"['ME Pfrender', 'K Spitze', 'J Hicks', 'K Morgan', 'L Latta']",2000,Conservation …,"In many applications of population genetics, particularly in the field of conservation biology, estimates of molecular diversity are used as surrogate indicators of less easily acquired measures of genetic variation for quantitative traits. The general validity of this approach to"
EMS-induced polygenic mutation rates for nine quantitative characters in Drosophila melanogaster,"['PD Keightley', 'O Ohnishi']",1998,Genetics,"Polygenic mutations were induced by treating Drosophila melanogaster adult males with 2.5 mm EMS. The treated second chromosomes, along with untreated controls, were then made homozygous, and five life history, two behavioral, and two morphological traits were"
Testing quantitative genetic hypotheses about the evolutionary rate matrix for continuous characters,"['LJ Revell', 'LJ Harmon']",2008,Evolutionary Ecology Research,"Aim: Provide a new multivariate hypothesis testing approach for the evolution of continuous characters in a phylogenetic context. Background: Brownian motion is the most commonly used model for the evolution of quantitative traits. Under multivariate Brownian motion, the"
The evolution of information suppression in communicating robots with conflicting interests,"['S Mitri', 'D Floreano', 'L Keller']",2009,Proceedings of the National …,"Reliable information is a crucial factor influencing decision-making and, thus, fitness in all animals. A common source of information comes from inadvertent cues produced by the behavior of conspecifics. Here we use a system of experimental evolution with robots"
Modeling gene expression evolution with an extended Ornstein–Uhlenbeck process accounting for within-species variation,"['RV Rohlfs', 'P Harrigan', 'R Nielsen']",2014,Molecular biology and …,"Much of the phenotypic variation observed between even closely related species may be driven by differences in gene expression levels. The current availability of reliable techniques like RNA-Seq, which can quantify expression levels across species, has enabled"
The response to artificial selection from new mutations in Drosophila melanogaster.,"['A Caballero', 'MA Toro', 'C Lopez-Fanjul']",1991,Genetics,Twenty generations of divergent selection for abdominal bristle number were carried out starting from a completely homozygous population of Drosophila melanogaster. All lines were selected with the same proportion (20%) but at two different numbers of selected
A Quantitative Genetic Perspective on the Conservation of Intraspecifi c Diversity,['JBJ Hano'],1995,NA,ldenti $ ing appropriate units for the conservation of intraspecific variation requires consideration of the genetic basis of this variation. Most of the information available on the genetic basis of intraspecific variation has come from variation in molecular (primarily single
Microevolutionary support for a developmental hourglass: gene expression patterns shape sequence variation and divergence in Drosophila,"['T Cruickshank', 'MJ Wade']",2008,Evolution & development,SUMMARY A central goal of evolutionary developmental biology (Evo‐Devo) is to synthesize comparative molecular developmental genetics and its description of the dynamic relationship between genotype and phenotype with the microevolutionary
"Incipient allochronic speciation due to non-selective assortative mating by flowering time, mutation and genetic drift","['C Devaux', 'R Lande']",2008,… of the Royal Society B: Biological …,We model the evolution of flowering time using a multilocus quantitative genetic model with non-selective assortative mating and mutation to investigate incipient allochronic speciation in a finite population. For quantitative characters with evolutionary parameters satisfying
"EVOLUTION, PHYLOGENY, SEXUAL DIMORPHISM AND MATING SYSTEM IN THE GRACKLES (QUISCALUS SPP.: ICTERINAE)",['M Björklund'],1991,Evolution,"According to theory, two consequences of sexual selection are sexual dimorphism in size and secondary sexual characteristics, due to either intra‐or intersexual selection. In this paper I suggest three criteria for the test of an evolutionary hypothesis involving quantitative"
Spontaneous mutation for a quantitative trait in Drosophila melanogaster. II. Distribution of mutant effects on the trait and fitness,"['MA López', 'C López-Fanjul']",1993,Genetics Research,"Starting from a completely homozygous population of Drosophila melanogaster, lines have been derived and subjected to 47 generations of divergent selection for abdominal bristle number (20 lines selected in each direction) or to 60–67 generations of inbreeding (100 B"
Genetic analysis of genome-scale recombination rate evolution in house mice,"['BL Dumont', 'BA Payseur']",2011,PLoS genetics,"The rate of meiotic recombination varies markedly between species and among individuals. Classical genetic experiments demonstrated a heritable component to population variation in recombination rate, and specific sequence variants that contribute to recombination rate"
"Quantitative characters, phylogenies, and morphometrics",['J Felsenstein'],2002,Systematics Association Special Volume,"Morphometrics gives us a source of quantitative characters, and thus raises the question of how to use them in inferring phylogenies. I argue here that we can use statistical models for quantitative characters evolving along phylogenies, but that these require knowledge of the"
Extant mammal body masses suggest punctuated equilibrium,"['TM Mattila', 'F Bokma']",2008,… of the Royal Society B: Biological …,"Is gradual microevolutionary change within species simultaneously the source of macroevolutionary differentiation between species? Since its first publication, Darwin's original idea that phenotypic differences between species develop gradually over time, as"
Phylogenetic hypotheses under the assumption of neutral quantitative‐genetic variation,['M Lynch'],1989,Evolution,There are many situations in which the only available characters for reconstructing phylogenies are morphological. Those traits that are subject only to the forces of mutation and random genetic drift can be used to obtain unbiased estimates of phylogenetic
MIPoD: a hypothesis-testing framework for microevolutionary inference from patterns of divergence,"['PA Hohenlohe', 'SJ Arnold']",2008,The American Naturalist,"Despite the many triumphs of comparative biology during the past few decades, the field has remained strangely divorced from evolutionary genetics. In particular, comparative methods have failed to incorporate multivariate process models of microevolution that include genetic"
Statistical framework for phylogenomic analysis of gene family expression profiles,['X Gu'],2004,Genetics,"Microarray technology has produced massive expression data that are invaluable for investigating the genomewide evolutionary pattern of gene expression. To this end, phylogenetic expression analysis is highly desirable. On the basis of the Brownian process"
Effective size and polymorphism of linked neutral loci in populations under directional selection,"['E Santiago', 'A Caballero']",1998,Genetics,The general theory of the effective size (Ne) for populations under directional selection is extended to cover linkage. Ne is a function of the association between neutral and selected genes generated by finite sampling. This association is reduced by three factors: the
Mutation predicts 40 million years of fly wing evolution,"['D Houle', 'GH Bolstad', 'K van der Linde', 'TF Hansen']",2017,Nature,"Mutation enables evolution, but the idea that adaptation is also shaped by mutational variation is controversial 1, 2, 3, 4. Simple evolutionary hypotheses predict such a relationship if the supply of mutations constrains evolution 5, 6, but it is not clear that"
Detection of punctuated equilibrium from molecular phylogenies,['F Bokma'],2002,Journal of Evolutionary Biology,"The theory of 'punctuated equilibrium'hypothesises that most morphological change in species takes place in rapid bursts triggered by speciation. Eldregde and Gould postulated the theory in 1972, as an alternative to the idea that morphological change slowly"
Spontaneous Mutational Variation for Body Size in Caenorhabditis elegans,"['RBR Azevedo', 'PD Keightley', 'C Laurén-Määttä']",2002,Genetics,"We measured the impact of new mutations on genetic variation for body size in two independent sets of C. elegans spontaneous mutation-accumulation (MA) lines, derived from the N2 strain, that had been maintained by selfing for 60 or 152 generations. The two"
The mermaid's tale: four billion years of cooperation in the making of living things,"['KM Weiss', 'AV Buchanan']",2009,NA,"Even after 150 years, Darwin's theory of evolution by natural selection is irresistibly compelling. But how can this idea—in which competition prevails—be consistent with all that we know about the thoroughly cooperative nature of life at the genetic and cellular level"
POLYGENIC MUTATION IN DROSOPHILA MELANOGASTER: ESTIMATES FROM DIVERGENCE AMONG INBRED STRAINS,"['TFC Mackay', 'RF Lyman', 'MS Jackson', 'C Terzian']",1992,…,"A highly inbred line of Drosophila melanogaster was subdivided into 25 replicate sublines, which were independently maintained for 100 generations with 10 pairs of unselected flies per generation. The polygenic mutation rate (VM) for two quantitative traits, abdominal and"
Thinking about the evolution of complex traits in the era of genome-wide association studies,"['G Sella', 'NH Barton']",2019,Annual review of genomics and human …,"Many traits of interest are highly heritable and genetically complex, meaning that much of the variation they exhibit arises from differences at numerous loci in the genome. Complex traits and their evolution have been studied for more than a century, but only in the last"
Reducing mutation load through sexual selection on males,"['K McGuigan', 'D Petfield']",2011,… : International Journal of …,"Mutation load is a key parameter in evolutionary theories, but relatively little empirical information exists on the mutation load of populations, or the elimination of this load through selection. We manipulated the opportunity for sexual selection within a mutation"
Polygenic mutation in Drosophila melanogaster: non-linear divergence among unselected strains.,"['TF Mackay', 'RF Lyman', 'WG Hill']",1995,Genetics,A highly inbred strain of Drosophila melanogaster was subdivided into 20 replicate sublines that were maintained independently with 10 pairs of randomly sampled parents per generation for 180 generations. The variance between lines in abdominal and sternopleural
Are heritability and selection related to population size in nature? Meta‐analysis and conservation implications,"['JLA Wood', 'MC Yates', 'DJ Fraser']",2016,Evolutionary applications,"It is widely thought that small populations should have less additive genetic variance and respond less efficiently to natural selection than large populations. Across taxa, we meta‐analytically quantified the relationship between adult census population size (N) and"
CORRELATION BETWEEN ANOLIS LIZARD DEWLAP PHENOTYPE AND ENVIRONMENTAL VARIATION INDICATES ADAPTIVE DIVERGENCE OF A SIGNAL …,"['J Ng', 'EL Landeen', 'RM Logsdon']",2013,… : International Journal of …,"Although the importance of signals involved in species recognition and sexual selection to speciation is widely recognized, the processes that underlie signal divergence are still a matter of debate. Several possible processes have been hypothesized, including genetic"
The role of genetic drift in shaping modern human cranial evolution: a test using microevolutionary modeling,['HF Smith'],2011,International journal of evolutionary biology,"The means by which various microevolutionary processes have acted in the past to produce patterns of cranial variation that characterize modern humans is not thoroughly understood. Applying a microevolutionary framework, within-and among-population variance/covariance"
"Cumulative effects of spontaneous mutations for fitness in Caenorhabditis: role of genotype, environment and stress","['CF Baer', 'N Phillips', 'D Ostrow', 'A Avalos', 'D Blanton']",2006,Genetics,"It is often assumed that the mutation rate is an evolutionarily optimized property of a taxon. The relevant mutation rate is for mutations that affect fitness, U, but the strength of selection on the mutation rate depends on the average effect of a mutation. Determination of U is"
PROPERTIES OF SPONTANEOUS MUTATIONAL VARIANCE AND COVARIANCE FOR WING SIZE AND SHAPE IN DROSOPHILA MELANOGASTER,"['D Houle', 'J Fierst']",2013,Evolution: International Journal of Organic …,"We estimated mutational variance–covariance matrices, M, for wing shape and size in two genotypes of Drosophila melanogaster after 192 generations of mutation accumulation. We characterized 21 potentially independent aspects of wing shape and size using geometric"
Positive association between copia transposition rate and copy number in Drosophila melanogaster,"['SV Nuzhdin', 'EG Pasyukova']",1996,Proceedings of the …,"Rates of copia transposition were determined directly, by cytological in situ hybridization analysis of sites of copia insertion in progeny of males from sublines of an inbred strain with different genomic copia copy numbers. Copia transposition rate was positively and"
Population bottlenecks increase additive genetic variance but do not break a selection limit in rain forest Drosophila,"['B Van Heerwaarden', 'Y Willi', 'TN Kristensen']",2008,Genetics,"According to neutral quantitative genetic theory, population bottlenecks are expected to decrease standing levels of additive genetic variance of quantitative traits. However, some empirical and theoretical results suggest that, if nonadditive genetic effects influence the"
Are molecular markers useful predictors of adaptive potential?,"['EA Mittell', 'S Nakagawa', 'JD Hadfield']",2015,Ecology Letters,"Estimates of molecular genetic variation are often used as a cheap and simple surrogate for a population's adaptive potential, yet empirical evidence suggests they are unlikely to be a valid proxy. However, this evidence is based on molecular genetic variation poorly"
Prediction of rates of inbreeding in populations selected on best linear unbiased prediction of breeding value,"['P Bijma', 'JA Woolliams']",2000,Genetics,Predictions for the rate of inbreeding (Δ F) in populations with discrete generations undergoing selection on best linear unbiased prediction (BLUP) of breeding value were developed. Predictions were based on the concept of long-term genetic contributions using
Quantitative genetics of scale counts in the garter snake Thamnophis sirtalis,"['MR Dohm', 'T Garland Jr']",1993,Copeia,"This study addresses the quantitative genetic basis of phenotypic variation and covariation for a series of meristic traits in the garter snake Thamnophis sirtalis fitchi (six head scale counts: loreals, supra-and infralabials, pre-and postoculars, temporals; three body scale"
The contribution of recombination to heterozygosity differs among plant evolutionary lineages and life-forms,"['JP Jaramillo-Correa', 'M Verdú']",2010,BMC …,"Despite its role as a generator of haplotypic variation, little is known about how the rates of recombination evolve across taxa. Recombination is a very labile force, susceptible to evolutionary and life trait related processes, which have also been correlated with general"
The maintenance of polygenic variation in finite populations,['D Houle'],1989,Evolution,"Models of the maintenance of genetic variance in a polygenic trait have usually assumed that population size is infinite and that selection is weak. Consequently, they will overestimate the amount of variation maintained in finite populations. I derive"
On the persistence and pervasiveness of a new mutation,"['A Garcia‐Dorado', 'A Caballero', 'JF Crow']",2003,Evolution,It has frequently been assumed that the persistence of a deleterious mutation (the average number of generations before its loss) and its pervasiveness (the average number of individuals carrying the gene before its loss) are equal. This is true for a particular simple
The limits to knowledge in conservation genetics,['L Nunney'],2000,Evolutionary biology,"Science is a “way of knowing”(Moore, 1984) that distinguishes itself by developing theories capable of prediction; however, in studies at the interface of evolution and the environment, this task can become formidable. The future direction of evolutionary change is intrinsically"
The evolution of age-specific mortality rates in Drosophila melanogaster: genetic divergence among unselected lines,"['SD Pletcher', 'D Houle', 'JW Curtsinger']",1999,Genetics,"Age-specific effects of spontaneous mutations on mortality rates in Drosophila are inferred from three large demographic experiments. Data were collected from inbred lines that were allowed to accumulate spontaneous mutations for 10, 19, and 47 generations. Estimates of"
"Influence of dominance, leptokurtosis and pleiotropy of deleterious mutations on quantitative genetic variation at mutation-selection balance","['XS Zhang', 'J Wang', 'WG Hill']",2004,Genetics,"In models of maintenance of genetic variance (VG) it has often been assumed that mutant alleles act additively. However, experimental data show that the dominance coefficient varies among mutant alleles and those of large effect tend to be recessive. On the basis of"
Multigeneration maximum-likelihood analysis applied to mutation-accumulation experiments in Caenorhabditis elegans,"['PD Keightley', 'TM Bataillon']",2000,Genetics,We develop a maximum-likelihood (ML) approach to estimate genomic mutation rates (U) and average homozygous mutation effects (s) from mutation-accumulation (MA) experiments in which phenotypic assays are carried out in several generations. We use simulations to
Quantitative genetics of ovariole number in Drosophila melanogaster. II. Mutational variation and genotype-environment interaction,"['ML Wayne', 'TFC Mackay']",1998,Genetics,"The rare alleles model of mutation-selection balance (MSB) hypothesis for the maintenance of genetic variation was evaluated for two quantitative traits, ovariole number and body size. Mutational variances (VM) for these traits, estimated from mutation accumulation lines, were"
Genotype× environment interaction for male attractiveness in an acoustic moth: evidence for plasticity and canalization,"['AM Danielson‐Francois', 'JK Kelly']",2006,Journal of …,"The lek paradox arises when choosy females deplete the genetic variance for male display traits from a population, yet substantial additive genetic variation (VA) in male traits persists. Thus, the lek paradox can be more generally stated as one of the most fundamental"
Adaptation and extinction in changing environments,"['R Bürger', 'M Lynch']",1997,"Environmental stress, adaptation and evolution","The extinction risk of a population is determined by its demographic properties, the environmental conditions to which it is exposed, and its genetic potential to cope with and adapt to its environment. All these factors may have stochastic as well as directional"
Gene expression evolves under a house-of-cards model of stabilizing selection,"['A Hodgins-Davis', 'DP Rice']",2015,Molecular biology and …,"Divergence in gene regulation is hypothesized to underlie much of phenotypic evolution, but the role of natural selection in shaping the molecular phenotype of gene expression continues to be debated. To resolve the mode of gene expression, evolution requires"
QUANTITATIVE GENETICS OF OVARIOLE NUMBER IN DROSOPHILA MELANOGASTER. I. SEGREGATING VARIATION AND FITNESS,"['ML Wayne', 'JB Hackett', 'TFC Mackay']",1997,Evolution,"The number of ovarioles of the Drosophila melanogaster ovary is a trait thought to be associated with female fecundity, and therefore is expected to be under strong natural selection. This hypothesis may be tested by examining patterns of genetic and"
"Did a discrete event 200,000–100,000 years ago produce modern humans?",['TD Weaver'],2012,Journal of human evolution,"Scenarios for modern human origins are often predicated on the assumption that modern humans arose 200,000–100,000 years ago in Africa. This assumption implies that something 'special'happened at this point in time in Africa, such as the speciation that"
Genetic basis of response to 50 generations of selection on body weight in inbred mice,['PD Keightley'],1998,Genetics,A long-established inbred strain of mice was divergently selected for body weight for 50 generations. Selection of new mutations affecting the trait eventually led to a divergence of approximately three phenotypic standard deviations between the high and low lines
